critic survey ashford hospit prime ahp amp kimco realti kim,0
analyst adopt bullish outlook robert half intern inc rhi,1
zack rank strong buy semiconductor stock mlnx intc mchp,2
setup like watch wed roku iq sfix shop spot ual goo twlo nflx xrt tsla sq bidu pypl labu biib kss kre,2
invesco ivz price target lower credit suiss group,1
mobil us inc tmu share declin tekn capit manag llc lift stake million,2
avalonbay commun inc avb could improv long portfolio less short report,1
jeff kagan mcdonald autom order system better wors mcd,2
rt helsinki underway worth note past year u approv foreign militari sale javelin,2
contrast pointer teloc pntr amp motorola solut msi,1
zack invest research lower alaska air group alk strong sell,2
mm cdix today msft amzn fb goog jnj jpm googol abc wfc wmt cvx hd pg unh pfe qcom,1
all asazf drrkf spb fbh,1
cah revers set bullish descend wedg like dip target post,2
fluor corpor flr analyst see ep,1
askhalftim weaker u dollar help myl,1
word food network run idea watch chef tabl netflix someth vi,1
rt bidu frustrat lot peopl choppi rang last year look readi breakout earn,1
loew corp l holder yakira capit manag inc trim stake million,1
align technolog algn given new price target morgan stanley,1
rt creo todo sto incondicional de yasabesquien ni guenmelo meduelesm xico por ste tipo de,1
rt attract put sell price skx put expens histori pbr biib pm ewz,2
insid sell varian medic system inc var svp sell share stock,2
rockwel collin inc col stock volatil highvista strategi llc cut hold,0
realest shift fed hcp ohi vtr wpc reit reit djr spx rut gld slv vix spi oil usdx dxi,1
maa max pain matur maxpain option,0
westpac bank corp rais stake thermo fisher scientif inc tmo billion,1
nasdaq share vol leader nflx iq qqq msft mu cmcsa csco sqqq fb aapl intc sbux foxa mrvl siri avgo roku ebay tqq amat,2
dividend growth champion highest sale growth ba mdt cb ao rop wba bdx,2
xrx new form xerox corpor stock news alert app,2
percent chang h descend order atmc pnx jc js am neog,1
pentair pnr schedul post quarterli earn wednesday,1
ip max pain matur maxpain option,0
nation oilwel varco inc nov given averag rate hold brokerag,1
ea aug sept call oi pretti fierc cc,1
lli new insid file director juan r luciano,1
rt hi wait talk stocku amibiti cryptocrazi student warw,1
rt interact broker revenu surg margin brokerag account ibkr td schw qqq spx via,1
rt morgan kinder morgan declar dividend announc result second quarter kmi ht,2
one exam bam cri hub cube,1
bullish swing trade setup thu jul includ chk gdx lyg rad stock,1
option maxpain chart free option app,2
emerson electr emr downgrad zack invest research hold,1
bullish big mac bullish occur jul expeditor intern washington,1
cop aug call big trade today stock volum vs oi,1
rop roper technolog best perform dividend aristocrat past decad good invest,2
investor buy share edison intern eix weak,1
long bond zb close tick lower upcom recess narr collaps zn txi bond es dxi nq,0
ecolab inc ecl see chikou drop tenkan chart ecl stock stockmarket,0
huge coin select low fee reliabl join binanc regist bonu,2
rost max pain matur maxpain option,0
better read rest opinion like part sound like thunderbolt aaf wo,2
nuan nuanc commun stock stockstowatch,1
institut investor think electron art inc ea,1
kimco rlti corp kim market valuat declin sharehold privat manag group inc rais posit,1
everest group downgrad hold zack invest research,1
retweet kmi kinder morgan beat report rev line,2
edward lifesci ew share declin sector asset manag inc cut hold million,2
rtn raytheon demo small x band precis approach radar stock news alert app,2
hd suppli hold inc hd stock price hit week high today,1
heyyy el chicl que est pegado en el uelo nivel del f tbol mundial igan llenando u bolsil,1
trade low fee binanc regist bonu plr hpq,0
analyst set expect suntrust bank inc q earn sti,1
crucial week darden restaur inc dri analyst say,1
bb amp co bbt expect post earn per share,2
watch list dbx ak cvx smh hon dk jci cme gm anf lbtya nue nvda ge x epd wba sgmo,0
huge coin select low fee reliabl join binanc regist bonu,2
stericycl srcl stock rate upgrad zack invest research,1
goldman sach rais concho resourc cxo stock buy rate,1
rt former employe like rylinda laterrica jennif speak alleg workplac sexual harass,1
pag bac dhi gild mgm symc nxpi aaba aapl len foxa eca gild opk brkb amd fox xsp axl azn msft,1
rt look one pennystock make extrem wealthi aryc aryc aapl agn brk cmg di ibm pf,1
appli optoelectron inc aaoi ep estim,1
rt network interest opinion piec futur sapien articl includ propos ui spn vs,2
bitmex offer leverag trade product digit currenc regist bonu,1
ntr report record quarterli net incom mm ep return common equiti revenu yoy,1
westrock wrk given price target stephen,1
rt long setup info syk expd su mxim crsp bbi hlf immu,1
digit rlti tr sh sh dlr receiv new coverag analyst bmo capit market,1
info new insid file granat sari beth transact code,1
top bearish list today avg g cll ovn ahf pnr cvn,2
need see minut old press releas abc abwn adx alkm alst amf andi avxl bemg,1
trade binanc discount trade fee regist bonu xwc xem bo,1
bitmex one fastest grow exchang world regist bonu cmt,1
extra space storag exr pt rais,1
crzo carrizo oil amp ga inc sec file form,1
cramer lightn round busi illinoi tool work bad stock suggest,0
xrx xerox corpor q xerox corpor earn confer call stock news alert app,2
rt big bullish unusu option activ detect di aal cck ge mlco big bearish amlp aal csx qcom pfe,1
cnp cnp assur cnp assur cnp juillet,1
rt mxc oil stock buy pullback mxc royl cei gbr oilandga oil bhp oil ped tgc dnr mnga amlp,1
accentur plc ireland acn share price declin crawford invest counsel inc lower hold,1
comerica cma announc quarterli earn result,1
csx kill estim rocket higher break new high,0
symc symantec ceo greg clark discuss state global cyber secur aspen secur forum stock news alert app,2
mani headwind stock overcom anytim soon invest,1
institut investor hate tjx compani inc tjx,0
symc q symantec earn confer call stock news alert app,2
rt fli watch ibm earn report ibm grpn,1
eog new sec file eog form k,1
current wave price best cheapest exchang trade crypto check,2
analyst see ep cb corpor cb,1
intern paper ip pt rais,1
activ alert trq turquois hill resourc tradeidea via free trade room,2
hampton hilton hotel brand expans push hlt,1
investor buy anadarko petroleum apc weak,0
coin list pump bot detect offici announc join us,2
sand capit manag llc boost incyt corp inci posit million valuat declin,2
hess seri prefer stock share cross yield mark he pra he preferredstock,2
rt spi option flow alert eem arri car jd bll v cazr bx vip opk bac wfc xop jw,2
zack analyst anticip laboratori corp america hold lh post quarterli sale billion,1
averi dennison avi given price target loop capit analyst,1
rt huge week earn kickoff mon nflx bac blk tue gs unh jnj wed ibm ms axp ebay,2
wall street breakfast googl face record b fine android csx txn ba inh nv pfe gs rcl ccl nclh,2
hd home depot test cup w handl entri,1
bidaskclub top stronglybought amgn mro data cci dlr well lli crm infi k sne psa nee hum,2
thought fb elimin fake news,0
morgan stanley initi coverag humana hum,1
borgwarn inc bwa receiv consensu rate buy brokerag,1
emo hum key yum im ms cab,1
analyst offer predict lyondellbasel industri nv q earn lyb,2
kansa citi southern ksu releas earn friday,1
rt premarket top gainer pixi adx aipt bioc cei sne glmd gogo obsv mysz wwe ato vstm uxin tndm,2
blk appar bear pattern confirm price continu rise,1
million sale expect lumentum hold inc lite quarter,1
xilinx inc xlnx market valu declin ashmor wealth manag llc cut million stake,2
holx chug along w size juli call oi,1
rt rsg gold mali stop top ichi,1
instant appl unlock cent iphon gs c unlockfus icloud freeunlock factoryunlock aapl unlock,1
low beauti ugli twin offer good opportun level hd low invest financ tradinghttp,1
rt keep name watchlist look similar potenti horizont base five twtr ttd aap lul,1
sentiment chang report fiserv inc fisv,1
ep expect suntrust bank inc sti,1
realli reflect fact vrx model rais drug price exponenti,1
rt watch latest stock signal video hotstock hd ttwo yndx use elliottwav indicat,1
get access premium paid group fraction price join us pe,2
disck high oi rang option expir maxpain option,1
binanc one promin exchang crypto regist bonu ubtc,1
mani nasdaq inc ndaq analyst bullish,1
analyst adopt bullish outlook alexion pharmaceut inc alxn,1
mallinckrodt mnk bond price fall,1
tractor suppli tsco price target increas analyst royal bank canada,1
daystogoarjunbabubirthday center star son singl hand ingl ganesh,2
brokerag set telu co target price,1
binanc stop loss featur help protect asset regist bonu,2
schw charl schwab corp morningstar schwab trade proposit client hasnt trade profitabili,1
join get stock like aapl f free make sure use link plu ca,2
made k option trade today thank trade glw jnpr vrsn nvro jcp,2
ep expect pnc financi servic group inc pnc quarter,1
anadarko petroleum buyback bing apc,1
cdix full revers go time mtg xlv celg endp gild czr ngd luv hal gern gld aig wmt lc jci glw,1
would submit jd someon bet,1
critic review seneca food corp class senea versu j smucker sjm,0
rt eqt eqt million gain eqt made notabl gain last trade sess,2
rt earn schedul market close today ibm axp ebay aa uri kmi ndl cci cp ptc cck bx bpfh ufpi,1
miss regist binanc close registr btc,1
eog eog resourc inc document k stock news alert app,2
discuss stir around expeditor intern washington inc expd week analyst say,1
pre market mover spx spi arnc vfc cb dal bac wat bsx syk dvn stockmarket,1
top gainer gt avro ffmh evvti gww opygi ual ltxb ppcci csx tpor asml mmyt bsnd tal nclh brk b,2
rt bewar media merger think twice tri buy shock doj appeal week challeng amp time warner de,0
bb amp corp bbt shift institut investor sentiment,1
insid alert evp gener counsel granat sari beth info bought share,2
interocean capit llc increas hold mondelez intl class mdlz,1
rt buy option land friday sr stock replac sq roku low pag pcg nktr kr esrx bbi ctx cmc,0
eqix new insid file meyer charl j transact code,1
rt wrong kmb asset sell retir,1
posit goldman sach concho resourc cxo follow upgrad,1
c h robinson chrw buy susquehanna upgrad stock,1
rt health mon cancer glyphos roundup poison farmer farmlif wednesdaywisdom us,0
short sale volum short interest atvi cool viab di,2
bought cpah sold avg w k share live chat st min trade check us,2
clf ak steel name show life,1
regeneron pharmaceut regn stock declin healthcor manag lp rais stake,1
invest crypto binanc get discount trade fee regist bonu,1
make sens electroneum tri help unbank make mass adopt happen let bring vote hom,2
rt jabbaz si pbr supera tbn podria armar nueva pierna al alza ya q lo haria c ma momentum q lo dia anterior,1
lite even need draw line chart setup know tend pretti good one,2
aku tertarik dengan satu mamat kat musician want ni rap dia bagu weh,1
perrigo prgo downgrad goldman sach group,1
calcul day expect return fbh,1
rt oke leader within pipelin sector interest altern etp nice base build easi int,2
askhalftim ma recov trade tension eas,0
entergi corp etr institut investor sentiment index worsen q,0
fortun brand home amp secur inc fbh analyst see ep,1
ep electron art inc ea expect,1
mastercard price target increas analyst oppenheim,1
big call activ cop stng nflx opk luv msft riot paa rig kor bx serv yndx,0
yoyow current worth check binanc registr current open,2
spx amp away look like spx hit upper blue tl resist well upper bb roughli tim,2
dsp group dspg finisar fnsr critic review,0
rt partial profit signal amp p also take partial profit fb gild opk pypl stock,2
critic contrast omnitek engin omtk gentex gntx,0
daytrad stock day aph complet list stock,1
trump america first left complet lost grip,0
diana containership inc press releas dcix maritim contain ship,1
cah ft gme omi wba,1
bax high oi rang option expir maxpain option,1
pnc pnc financi billion gain pnc made notabl gain la,2
lyondellbasel industri n v lyb analyst see ep,2
retail stock consid amzn bbbi dk lb qrtea sbh,1
motorola bag year us armi contract cap million motorola msi usarmi,1
dte energi co dte institut investor quarterli sentiment,1
tri swing trade servic built individu want trade longer term timefram around full time,1
ibm ppt acquisit continu invest build innov pipelin area includ ai secur bl,2
rockwel collin inc col stock volatil haven advisor llc increas hold,1
monsanto co new mon stock rose york capit manag global advisor llc up hold million,1
spectacular earn chart week nflx msft isrg unh dpz,1
msft report bell thursday say option market expect big swing,1
coin list pump bot detect offici announc join us,2
nxtd strong revers chart aker ogen oversold news odp staf one fade,2
ih markit ltd info upsid make week high,1
mattel mat downgrad hold bidaskclub,1
gold amp commod weekli review commod weekli forecast gold commod copper,1
discount trade sign today amp enjoy discount regist bonu,2
new uoa detect adsk call option expir trade bought ask,1
reach mileston varian medic system inc var short interest reveal someth,2
rt et daili digest larg amp mid cap stock amp premarket ca pzza,1
dte energi dte rais hold zack invest research,1
alxn max pain matur maxpain option,0
analyst feel idexx laboratori inc idxx reach record high,1
cenovu energi cve versu carrizo oil amp ga crzo financi comparison,1
analyst see ep fidel nation inform servic inc fi,1
volum chang last minut binanc mtl storm lun bittrex snt omg sc,1
rt wipro amp telcoin presenc citi billion asset employe one lead servic,2
rt brianelli congratul algn jennif olson wilk name one influenti peopl dentistri,1
hibbett sport inc hibb ep estim,1
vz open interest matur high put high call maxpain option,2
ashmor wealth manag llc cut xilinx inc xlnx stake stock valu declin,2
bash l cat hoge txt xarg e l amp amp echo l done,1
lmt ba noc rtn gd ldo defens nato stock option optionstrad,1
seem like nke lot domest sport market nba nfl adi took intern market footbal,2
buy signal detect stock xlnx unp rop tmo ksu mchp aapl zt,1
unum group unm price target lower barclay,0
rt final holli grail electr car within reach even end elon time expect l,1
bsx option order flow sentiment bullish,1
rt setup watch list nflx etsi abmd algn newr docu rng zto five rh follow chart courtesi,1
rt hr award three multi award idiq contract ceil total billionto provid thenat geospati intel,2
remot clinic medic offic base lab cannot even connect hq patient result arr,1
analyst expect albemarl co alb post quarterli sale million,1
unm unum group nyse unm fast graph fundament valuat number analysi,1
oil amp mine sector capit expenditur start go higher cat amp de benefit stephani link h,2
overwhelm data aerospac defens execut embrac digit thread digit twin accentur research,1
rt updat prv explain morn w siga win friday gwph medicin develop prv last month,2
evercor cowen name semi pick ahead earn nvda mu mrvl adi,1
rt primer piso el mercado ha acumulado subida seguida en lo ltimo por lo que mucho recuperan el entusiasmo de que pueda,2
c h robinson worldwid chrw stock rate upgrad jpmorgan chase amp co,1
hoplit capit manag lp lift mosaic co new mo stake million stock valu declin,1
eat hot key usa key ago ace ms fun,2
zcash zec price move trade crypto exchang today sign,1
theswitch gemroyalti tnrgold tnr v strateg stake internationallithium ilc ilc v amp royalti mariana,1
entergi etr price target increas analyst morgan stanley,1
everyon likey cl booooooom still look august cleq cl f cl cl f cl f opec futur,1
expeditor intern washington expd expect announc earn per share,2
hca healthcar inc hca holder commun trust amp invest co trim stake valuat rose,2
rt twtr mu lite ttd updat,1
rt helsinki underway worth note past year u approv foreign militari sale javelin,2
bwa max pain matur maxpain option,0
ep expect kimberli clark corpor kmb,1
aeo amd arnc azul bac bbt bpop cae cvna db exa gden gol irdmb jpm meli,1
rt notabl sale amp spread friday sr stock replac green line bought salmon line sold sq skx,1
hershey hsi downgrad consum edg,1
get access premium paid group fraction price join us la,2
abc open interest matur high put high call maxpain option,2
rt labcorp breach may expos million medic record daili mail say lh,1
rt want trade df find us follow exchang,1
aapl amat amgn amtd amzn atvi trade long short posit nasdaq sinc,1
today put long put spread qqq probabl profit next day see,2
spi dg consoldit inf ront bux level,1
loblaw compani limit l ep estim,1
calcul day expect return ksu,1
rt vrx mean bhc ceo joe papa,1
htz welcom new sucker short see ya week end,0
earn per share expect western union compani wu quarter,2
ancora advisor llc decreas stake symantec corp symc million share valu declin,2
rt invest invest fund marijuana opportun dm us aero abbv acan acnff acbff agstf ammj aphqf attbf axi,1
bearish outlook dollar tree inc dltr week,1
critic review gentex gntx versu delphi technolog dlph,0
valuengin upgrad mondelez intern inc common stock mdlz hold,1
stock etf amp fund review alphabet sye synh tal tax tayd tcmd tcpc team tedu tell tge,1
johnson amp johnson heavi volum johnson amp johnson stock jnj,1
alk lyc rareearth ev electricvehicl neodymium praseodymium,1
trader buy cardin health cah weak,0
expect water wat downgrad bofa merril,1
rt lockhe martin advanc look like anoth fail ralli lmt,0
move trade crypto exchang today sign regist bonu,1
wonder sentiment indic omc short ratio,1
short sale volum short interest slb oii nov ckh hal,2
updat pah chemic name tri breakout xlb trade,1
morgan stanley lower eqt eqt price target,0
rt new post stock market recap video aa axp ibm qqq spi,1
semiconductor compani bullish intc txn avgo nxpi mchp stm mxim amd qrvo asml,1
popular twtr btc x dia chco orbk ndaq xene cavm mufg nav regn lpl iart mtch cpsi mlnx ilf aee maxr,2
rt ibm martin schroeter talk compani revenu growth led cloud tune,2
eqt corp eqt valuat declin nwq invest manag compani llc up posit million,1
staf listen tend need celz fusz fb goog twtr sode ped gtmi btc riot btsc,0
rt bora chano short b worth tsla stock level lost half investor money,1
trade alert profit potenti everyday tri team fb nflx amzn agn tsla aapl gs,2
kimberli clark corp kmb given consensu recommend hold analyst,2
get charm set coffe cup saucer w lid william sonoma get nflx iot tvix ko hd,2
kimco realti corp kim improv lot chart past three month let see present p,1
rt facebook chef mark zuckerberg wird im code interview von techreporterin kara swisher gegrillt du hast genug ding kaputt,1
cvna dal disca esnt ggb lrcx meli mu tkc yriv,1
made total mu momo thank stewi,2
lite new insid file sepe matthew joseph transact code,1
bbt xlit yahoo financ messag board,1
wall street look gain edg california wildfir issu util giant pcg amp eix util,2
textron rais forecast premarket txt,1
fidel nation inform servc fi receiv new coverag analyst wolf research,1
pentair plc pnr go ex dividend juli th,1
snp high oi rang option expir maxpain option,1
seaport global secur lower ppg industri q earn estim ep previous,0
rt helsinki underway worth note past year u approv foreign militari sale javelin,2
avi new sec file avi form k,1
morgan stanley begin cover murphi oil mur stock share hit,2
whirlpool corpor whr ep estim,1
latest doubl meet avg gain alway unbias ardm glyc bzq athn etrm,2
crwg csoc dcix digaf drrx eaph dsx edxc ehvvf uhln gnpg fnhi gcei gahc egoh gigaf epaz,1
sysco co syy director richard g tilghman sell share,2
rt u hous start unexpectedli plung june permit xhb wf,1
analyst bearish side weyerhaeus compani wy week,1
metlif met price target lower b riley,0
hum ten sea man ad ago ga,1
tqqq today trade rang support resist trend,2
hd suppli hold inc hd given consensu rate buy analyst,1
rt quarterli earn msft live webcast juli pm edt cloud azur microsoft,1
stock etf amp fund review alphabet hei hewc hiw hog holx hpr hpt hqcl hqi hr hsc hscz,1
lt php function p w l c l gt foreach w p w l c els,2
feder realti invest trust frt expect post fy earn per share,2
rt et daili digest larg amp mid cap stock amp premarket gww ual,1
zack brokerag expect centerpoint energi inc cnp post quarterli sale billion,1
sign get fee discount bitmex regist bonu lala rrc snrg,1
bvtk huge bravatek darkpuls got amzn ba hon sbux mfst di,2
binanc stop loss featur help protect asset regist bonu poe,2
form pfizer inc mar file dolsten mikael pfe stock stockmarket,1
best cheapest exchang trade crypto check regist bonu dent,2
rt decard cl wti inventario eia hoy anduv ocupado asi que lo pongo tard,0
northrop grumman corpor noc analyst see ep,1
rt earn aa abt asml axp bac bhge blk ce clf cof csx cta dhr dpz ebay etfc expo ge gs gww hon ib,1
long short bitcoin swing x leverag bitmex regist bonu,1
billion sale expect well fargo amp co wfc quarter,2
snap inc snap director mitchel laski sell share stock,2
final time make move barclay initi coverag wec energi group wec price target,1
row price group inc trow analyst see ep,1
rt israel use american tax complet manifest destini mean clearli land would conveni f,1
zack analyst anticip u silica hold inc slca announc ep,1
bzun slow day still bullish support hold firm,2
fda ok j amp j singl tablet darunavir base regimen hiv premarket jnj gild pfe gsk,2
ctx new insid file henshal david j transact code,1
ethereum classic etc price verifi binanc accept new user,2
icnb late break news beverag abev bud sam rox born kof ko cce ccu stz cot deo dp,1
rt trader cast net stock flounder near week low name like ibm ccl lb cat,1
trust team side make differ invest tri optionalarm yet fre,2
marijuana produc spent million expand latinamerica argentina brazil colombia amp jama,2
binanc stop loss featur help protect asset regist bonu,2
zack analyst blog highlight appl nvidia lockhe martin intercontinent exchang johnson control,2
rt googl paid jd stake valu,1
rt trade jul trade costba trade multi entri exit rd trade vxx p th,1
gold amp commod weekli review commod weekli forecast gold commod copper,1
eastman chemic compani emn analyst see ep,1
reduc mcm kelli bag handbag purs brown w lock shoulder strap dust bag imagin mcm biib abil fast,1
time sell regenc center corpor reg complet multipl bottom chart pattern,1
investor sell american electr power aep strength aep,2
franc stock energi fti luxuri mc steel mt innov alt entertain tch telco sesg,2
rt impress energi tech year pqeff pe ko sdrl pxd oil,2
lite dead money sinc buy coupl month ago tri patient cut loos open tomorrow,0
adag capit partner gp llc boost hold deer amp co de million,2
huge coin select low fee reliabl join binanc regist bonu,2
brutal bcc wy sell harsh blow away earn lumber price ramp,0
open interest chang past two day call himx pbr sq stng hain fl teva nghc put rdfn gt,2
spi qqq dia blk voo sh sd ivv sso tqqq spxu old upro spxl splv rsp crf sqqq spx psq vfinx,1
coo cooper compani declar cash dividend nyse coo,1
stock pick cult amzn baba aapl algn nvda,1
pentair plc pnr expect post quarterli sale million,1
exchang binanc discount trade fee regist bonu emer orcl,1
barclay lower hess he underweight,0
ep expect dr pepper snappl group inc dp,1
rt everyon els focus cut edg compani tri captur next big thing could mayb make go,0
chemic compani updat week end juli lyb wlk hun fxz emn,2
join us get premium trade signal join us maid vib pareto cob seq ltc,2
go look reentri fdx today get close gap slightli pass yesterday low,0
undervalu dividend stock buy mid year k kr tsn cmi etn axp bbt alb ed,1
q ep estim ingersol rand plc ir lift keycorp,1
analyst set zoeti inc zt target price,1
stephen releas research report ad ozrk ba chkp cbsh cnob curo dal fey ftnt hbmd impv ingr,1
este lauder compani inc el stock price sentiment worsen,0
apa new insid file hoyt rebecca transact code,1
akam today trade akamai technolog inc date financ,1
candid short chkp xom cb mrk,1
nq f qqq sqqq ndx get closer target box,1
morgan stanley increas public servic enterpris group peg price target,1
travel compani inc trv ep estim,1
weyerhaeus co wy expect post earn per share,2
ua max pain matur maxpain option,0
himx broke long term downtrend seen chart continu expect need test fir,0
citigroup inc c sharehold lakewood capit manag lp increas stake million valuat declin,1
staf like play play gt feel free follow stock whisper celz,2
tsco short term long term trend posit posit sign,1
top gainer pm est staf mtsl chr asml mtb gww csx teum brkb mtg staygreen,2
rt et daili digest larg amp mid cap stock amp premarket schw pg,1
rt bora chano short b worth tsla stock level lost half investor money,1
nov revenu growth quarter quarter higher quarter last year novatti payment channel,2
today sysco corpor syy stock reach week high,1
morgan stanley begin coverag murphi oil mur,1
like arri move forward higher pt brokerag analyst hold,2
anyon know amzn put number amazon prime day sort like baba want,2
incyt inci stock rate lower morgan stanley,0
udr inc udr ep estim,1
cmcsa amp view realli intern realli goal educ countr,1
la acci n de advanc micro devic inc amd cierra el dia de hoy con precio de lare reportamo una va,1
rt big call activ mdlz cpb baba wll atvi gg mmp mnst aal pfe beri mo de spot,2
fb bc bfa f f c c,1
ethereum classic etc price binanc temporarili accept new user go,2
rt jdaniel inde trial centuri rounduptri dewaynejohnson glyphosateg wo,1
hilton worldwid hold inc hlt analyst bullish side week,1
chines automak kandi technolog group inc kndi said bring electr vehicl unit stat,1
cei nyse amex camber energi soar today plan ea mu pypl siri fisv symc chkp,1
