downgrad acc kl avgo alv fhn clx hcsg cien cotv mmp colm ingr irwd exr andx,1
rt new post break bank break see market xlf xlk xli gs bac stt spgi,1
next stanley black amp decker inc swk form wedg chart pattern,1
mkc mccormick amp compani incorpor sec file form,1
morn watchlist spi iwm appn momo etsi seem tad slow,1
big call activ fb pvh nvda de bwa nbr amzn ostk avgo kem jci pep gs grub,1
compar glu mobil gluu amp evolv system evol,1
ep unum group unm expect,1
rt option maxpain chart qqq free option app,2
short sale volum short interest amd txn intc mchp nvda,2
wallstreet ignor billion eu fine alphabet realmoneysod goog googl,2
nowher chart say alphabet could rise realmoneysod goog googl,1
analyst bullish oneok inc oke week,1
trow open interest matur high put high call maxpain option,2
xilinx inc xlnx svp salil raje sell share,2
see cdix offer qqq aapl tvix veon csco siri rook mu msft fb sqqq intc cmcsa amat nvda,1
rt new coin ad kbc fti pch quro seer coni ess onl otb pai got thrt bitscreen h,1
binanc fee x less bittrex regist bonu sky pepe zil ric,1
he high oi rang option expir maxpain option,1
ontario teacher pension plan board stake nobl energi inc nbl up million share rose,2
ga price histor rise memori day go sideway summer fall labor day chart,1
rt watch us report live floor nyse week weekli wrap includ play rh glmd hrb etsi twx bsx,2
earn week nflx bac msft ge blk gs unh ibm jnj clf jbht pgr abt ms isrg axp skx aa,1
believ see vip septemb wish think sell stuff vipshop,2
autozon inc azo riski short interest increas,2
johnson control intern plc jci expect post quarterli sale billion,1
review kimco realti kim ashford hospit prime ahp,1
keycorp research analyst rais earn estim dte energi co dte,1
rt pfe lli announc posit top line result phase trial tanezumab treatment osteoarthr oa pain,0
join binanc fastest grow exchang world regist bonu,2
oldprobelm solut energi psycholog futur spx nasdaq es f nq f cl f gc f xom amzn googl avgo,1
fy ep estim boston properti inc decreas suntrust bank bxp,1
join us signal multipl paid group one join us blk ico itc,2
note intc contempl acquir nvda earli miss opportun,1
kucoin distribut everi fork mean get free airdrop regist bonu,2
mani pultegroup inc phm analyst bullish,1
tyson food inc tsn expect post quarterli sale billion,1
ecolab inc ecl expect announc earn per share,2
alcoa cut adjust ebitda forecast cite tariff share slide,1
zack brokerag anticip borgwarn inc bwa announc earn per share,2
mine gld energi economi es oil rt ontminingassoc goldcorp inc maura kolb overse compani par,1
cardano ada price check binanc registr current open,1
aap advanc auto part inc sec file form,1
homrich amp berg up home depot inc hd hold million,1
averag gain k nflx optionstrad thank option trade,2
amp amp amp amp amp amp amp amp sd sd amp amp,1
fb e c ac c ac ec,1
mdlz high oi rang option expir maxpain option,1
susquehanna may up stake c h robinson chrw,1
el pay settl eeoc class sex discrimin lawsuit,0
zack invest research downgrad genocea bioscienc gnca sell,1
bidu china main play stick,2
portfolio john auther nsp ba dltr algn,1
aker surg compani find account error previou financi pave way buyout b,0
rt eu rule seem unlik impair googl econom keybanc goog,1
nickel pio cav tlm pan igo avq orn sbr arl cmi hgm lci mth sgq hnr wcn czi po gal g vm,0
vz move motley fool messag board,0
tuesday top analyst upgrad downgrad part amat arw bcrx bldr crl cost gnrc gt ilmn innt intc,2
tsla dnkn evhc md chano live cnbc,1
rt morn price volum leader amzn nflx aapl baba bac brk b mu ba iq fb msft googl see full list,1
roe busi get impress ddr roe almost crack year,2
rt good analysi pfe drug price revers due pressur al,2
annali capit manag inc nli sharehold penn mutual life insur compani up posit,1
bitmex allow go long short trade regist bonu box ga,2
dang eat salt mmm sea hot mr fit,2
analyst bearish side udr inc udr week,1
million dollar trade bitmex join us regist bonu mgo,2
bot discord notifi faster crypto tracker bot join us hsh fcx,1
get access premium paid group fraction price join us rf,2
rt decard cl wti setup princip potenciado por zona contra target el primero se cumplio para el resto de la posicion el stop,0
rt watch us report live floor nyse week weekli wrap includ nvda jd vrx roku bkng symc tt,1
rt invest invest fund marijuana opportun dm us aero abbv acan acnff acbff agstf ammj aphqf attbf axi,1
news wfc su former wfa advisor broke away took signific book busi,0
mhk look great pullback unwarr rate rise,2
walgreen boot allianc inc wba insid stefano pessina purchas share stock,2
odp stapl want merg gov consid amzn competitor amzn top competitor e,2
rt go jnj quarter stand incred portfolio manag like great gm ceo gorski trad,2
us semiconductor firm xilinx buy china ai hardwar entiti say valu entiti knowhow talent,2
rt there goe sode break thing least get paid fix acm aegn agx bflbf bld dy em,1
ep expect loew co l quarter,1
rt report activist investor launch campaign record pace drive return xrx nwl ge vrx pf,1
rt nv kymriah q sale miss consensu gt gild entresto q sale beat consensu final,1
eastman schedul second quarter financi result news releas sec form k file teleconfer emn,1
alphabet inc class googl set new week high,1
rt spn posit becom leader token social network network blockchain cryptocurr http,1
billion sale expect molson coor brew co class b tap quarter,1
binanc fastest grow crypto exchang join us regist bonu,2
rt follow po coin zoi opcx dev xsn bitg ult xrh wage colx xlq ext flm gic dxc spd,0
rt vinni zto ibd candid swing last week break thx b iq bzun,2
carmignac gestion increas pioneer natur resourc co pxd hold million,1
monacoin mona price kucoin distribut everi fork mean get free airdrop,2
rt one insur gave glimps autonom auto insur work f gm tsla trv,1
trade crypto binanc get discount trade fee regist bonu,1
carrizo oil amp ga crzo receiv buy rate royal bank canada,1
analyst see ep mallinckrodt public limit compani mnk,1
ep expect everest group ltd,1
rt pbr la estat brasil petrobra abri la puerta una venta futura de su unidad de oleoducto embarqu de crudo,1
averi dennison corpor avi declin short share,2
rt spx spi qqq xlf bac nflx iwm tnx vix uvxi tvix vxx svxi vmin tgt xrt kss jcp bbbi bbi wmt xlu retailsal,2
current qtum price quick sign binanc close registr,1
short sale volum short interest cah omi cv rad tfx,2
reilli automot orli reach new week high,1
susquehanna intern group llp boost million quali call qli posit liberti mutual group,2
kr thank put radar low readi break trendlin resist,1
cci crown castl report second quarter result rais outlook full year,1
whirlpool whr upgrad zack invest research hold,1
ua take page sfix playbook introduc armourbox smart individu brand start,2
essex properti trust ess barclay reaffirm overweight rate today target share,2
week hi watch list twlo sfix fb algn xlk tqqq sdrl qqq rcii v goog azn xli adb amzn trip,1
cy new form cypress semiconductor corpor stock news alert app,2
wallstreet misterfishman via ihub nnrx rumor nutranom possibl merger,1
zack invest research lower unit technolog utx hold,0
sport good price head right direct dk spwh jout hibb,2
next corn incorpor glw form bearish multipl bottom pattern,1
compar sientra sien zimmer biomet zbh,1
blue apron hold inc aprn gener counsel benjamin c singer sell share stock,2
hon rop compress near ath deck readi laucnh,1
msft huge earn report tomorrow x call put heavi volum,2
rt ye twitter janab yaha machish se nahi hamari myle e laga karti mr hiva name suna hi ho,1
rt lo que la comisi n europea llama abuso yo lo llamo moat la ventaja competitiva de googl googl es tan amplia que ti,1
nflx creat comedi radio channel siri wsj,1
hca healthcar inc hca holder commun trust amp invest co decreas stake,2
cl lod pmet amet cl f cl cl f cl oil daytrad opec futur,1
rt downsid momentum alert hasbro tradeidea via free trade room,2
coin list pump bot detect offici announc join us,2
given huge media exposur surpris one check chano invest record,2
srpt insid sell bo cumbo chief commcl offic holder richard done b plan make look,1
bwa tap main eep stay bro,1
rt wonder want work throw bone know compani go dow,1
oneok inc oke fuel run low stock reach week high today,0
crucial week c h robinson worldwid inc chrw analyst say,1
ep expect northrop grumman corpor noc,1
white petroleum wll share gap,2
ep expect fiserv inc fisv quarter,1
ual incred number repurchas share quarter netpayoutyield aal,2
analyst see ep western union compani wu,1
btw estim earn per share ip current price,2
best buy bbi upgrad zack invest research buy,2
asian stock eas ralli solid us perform schw schw brentcrudemarket crudeoilmarket,1
financi review brown forman co class b bf b versu constel brand inc class stz,1
cog cabot oil amp ga million gain cog made notabl gain th,2
bad intu properti intu look deutsch downgrad share,0
rt vip vip vip vip vi,2
rt pfizer lilli tanezumab success late stage osteoarthr pain studi premarket pfe,1
ralli crude keep market green today low volum day spi almost pm b,0
yandex n v yndx valuat declin holder dsam partner llp decreas posit million,1
join us signal multipl paid group one join us gp dxi edr,2
thought scyb aph deal seem,1
hoy no gobiernan supermegacorrupto tengan piedad con la corrupci n la est n engordando demasiad,0
motorola solut msi stock rate lower zack invest research,0
dash dash price check binanc registr current open,1
adb buy call hao success rate,2
look honest profit trade call recommend advic join btc,2
row price group trow price target rais,1
nordstrom jwn destin xl group dxlg head head comparison,1
ae open interest matur high put high call maxpain option,2
rt ice nyse ice complet acquisit chicago stock exchang chx,1
analyst expect averi dennison corp avi announc earn per share,2
could american electr power compani inc aep decreas even stock form doubl bottom pattern,1
rt airdrop dxc con ref registro en telegrambot haz la,1
short sale volum short interest stm smtc vsh,2
review seneca food corp class senea j smucker sjm,1
q ep estim capit one financi corp cof decreas william blair,1
unusu heavi option volum today open includ mhk fast mar mnst kor,1
vulcan valu partner llc increas cv health corp cv stake million stock declin,1
nation oilwel varco inc nov institut investor sentiment analysi,1
pnc finl svc group inc pnc holder wellington manag group llp lower stake million sto,0
rt investorintel tnrgold fine tune royalti model green energi metal gemroyalti tesla,2
told ya ebay would krack long happ one vermin thank matter profit,2
fiserv inc fisv expect post earn per share,2
rt oneok magellan downgrad mplx sunoco upgrad jefferi oke mmp mplx sun,1
rt earn aa abt asml axp bac bhge blk ce clf cof csx cta dhr dpz ebay etfc expo ge gs gww hon ib,1
sysco corpor stock test high syy,1
rt odger nutanix deliv extrem low latenc amp high iop thank data local amp next gener hypervisor ahv desi,1
icymi jnj growth depend zytiga,2
row price group trow downgrad zack invest research,1
rt premarket top gainer cbio uuuu top aker eric pavm sdi mdg mtg nok csx yang asml ms dust brk b ht,2
comput softwar enterpris sector highlight last week crm bzun keep sector radar,2
srcl open interest matur high put high call maxpain option,2
rt helsinki underway worth note past year u approv foreign militari sale javelin,2
henri schein inc hsic expect announc earn per share,2
trade option usual financ tech made good money,2
dang flow ms im fit bwa,2
bull crossov stock bce ldo rng trq,1
ep u silica hold inc slca expect,1
bioaq fortun favor bold stng f dal uvxi bbd fcx msft iq pfe uso c xle ak teva mfgp bmi,2
person feel infrastructur coin era infrastructur coin help build rel l,2
rt biotech hc new revisit week low akao cyh dnli fbio gnca idra npd,0
outperform stock haysplc londonstockexchang chartmil,1
invesco ivz price target lower credit suiss group,1
nightli unusu option volum review axta ggp nxpi czr opk,1
hcw srpt given signific clinic regulatori updat expect next month bare major com,1
intel intc stock rate reaffirm royal bank canada,1
barclay initi coverag nextera energi nee,1
ep hibbett sport inc hibb expect,1
hrl high oi rang option expir maxpain option,1
bot detect coin list faster offici announc join us mda gsc,2
overbought larg cap stock week rsi gt full report orcl lmt amgn,2
rt fang stock lead nasdaq broad rush tech ahead q earn thur gain new high,2
dte energi dte rate increas hold zack invest research,1
bxp open interest matur high put high call maxpain option,2
rt wrong kmb asset sell retir,1
mani jacob engin group inc jec analyst bullish,1
move trade crypto exchang today sign regist bonu,1
new rate coverag morgan stanley help pioneer natur resourc pxd stock week,2
ep expect aon plc aon quarter,1
stock etf amp fund review alphabet sir site size sji sjr skt sky slg sli slyv sm smlp,1
cdix news gnpx cyad kn boom sivb enva dnjr exa ehth chke flex chtr lbrdk tndm fii ebio,1
wonder risk cb day volatil,0
icon icx trade trade crypto binanc get discount trade fee,1
ae corpor ae analyst see ep,1
ep expect unit parcel servic inc up,1
water corpor wat form wedg chart pattern could one worst perform go forward,0
gener invest manag llp continu hold hold schein henri inc hsic,1
protestor outnumb viewer drown band golf trip famili busi trip,0
smithfield trust co stake pnc financi servic group inc pnc,2
q ep estim carrizo oil amp ga inc increas keycorp crzo,1
overview chang h creva lnc nto chang h toa rbbt sc,1
american electr power aep stock rate upgrad zack invest research,1
rt vanadium hit year high mani asx list compani progress project tng tno look cheap,2
big put activ dust hyg eem gld iyr tqqq xle xlf,1
suntrust bank comment feder realti invest trust fy earn frt,2
rt gain sinc articl publish sam byd cv psa,2
jb hunt transport jbht equal weight rate kept today morgan stanley target price set,1
review luk fook hold intern lkflf amp signet jewel sig,2
rt breakingnew earn releas axp,1
exchang binanc discount trade fee regist bonu xst spr,1
kansa citi southern ksu cut sell zack invest research,0
rt gemroyalti tnrgold tnr v shotgun gold project gold alaskan eleph countri alaska ng,1
ep fluor corpor flr expect,1
join get stock like aapl f free make sure use link peopl,2
rt rank top moon end year protocol food,2
mmyt mbcn ntwk wnc stl vli mur nom mth cub detail,1
reitero en que trabajar con twig es una completa gozada bye bye lt php echo var gt espero que no volvamo ver,1
compar j smucker sjm amp seneca food corp class senea,1
pepsico inc join nasdaq index begin juli ndaq,2
earn per share expect amp bank co mtb quarter,2
analyst bearish autozon inc azo week,1
auton cut underweight morgan stanley,0
unm max pain matur maxpain option,0
rt houldn ce u ed iz tv expo ure ta open trip club waz initi j ottawaon z bare fax c,1
hous start fallen nine month low annual hous construct drop june dgl,0
morgan stanley reiter row price group trow equal weight pt,1
oneok oke price target rais,1
q ep estim american tower corp amt reduc keycorp,1
old articl chano evhc worth noth,2
trend revers alert apa apach tradeidea via free trade room,2
rt compani report earn bell plx axp aa ibm ebay ptc uri recn kmi rli cci slg cp,1
j huang invert adjac matric random regular graph,1
rt unusu put buy fox x averag volum opk x bita x ca x avgo x nsc x akrx x brk x,1
scan result stochast sell signal today bxb gc ddr dui wmi cvf,1
digit realti trust dlr move bmo capit initi much share worth,2
zack analyst expect american tower corp amt post earn per share,2
pentair declar goe ex dividend tomorrow pnr,1
equinix eqix cover bmo capit expect,1
hartford financi servic group inc hig ga form bearish doubl bottom pattern,1
trade monday adob system boe cme ulta beauti unitedtechnolog,1
ms morgan stanley morningstar strong q result morgan stanley sign slow momentum persist narr,2
new airdrop retengo airdrop reg token complet simpl task reg e,1
auton cut underweight morgan stanley,0
rt notabl spread thursday sr stock replac green line bought salmon line sold symc tho rc,1
could zoeti inc class zt see revers seller came,1
dish new insid file execut vice presid jame defranco,1
rt similar hlf qcor mnk tsla short amaz stori result,1
advanc auto part aap pt rais,1
contrast miragen therapeut mgen amp laboratori corp america lh,1
libya oil problem libya declar forc majeur anoth oil port amp yemen iran back houthi say,0
analyst bearish nuanc commun inc nuan last week,1
free stock watchlist millionair stock trader mmex wynn amzn,2
rt mz chano see neglibl chanc evhc kkr deal break wait,1
caught wallstreet bank earn yet listen fill,1
link u dollar help myl,2
efx equifax acquir datax term disclos,1
rt look like booth nation associ home care financi manag confer next,2
made littl yesterday gave back today happen coupl week row ad stz lt,1
head head analysi jacob engin group jec orion group orn,1
piper jaffray compani rais comerica q earn estim ep previous cma cma,1
hum bad technic rate show decent setup pattern,0
bak cc cvna dal disca esnt ggb hep lrcx meli mu tal tkc yriv,1
good age even think hard flatten ed space,2
btw look csco h dumbest move mkt sane say,0
dividend champion stock price potenti gt ori dov nue abm itw gd nc ph swk pnr seic,2
cme group cme upgrad buy bidaskclub,1
rt fang trade last time nation leagu mlb star game fb amzn,1
took loss aapl amp tsla amzn amp nflx put pay big thx option trade,1
rt sfix rgnx lulu tjx vnom pe isrg goo pypl sq wwe aapl iq roku huya atvi ttwo ea spot anet post kl run,1
hd oppenheim posit home depot,1
drove min shop lost custom wi,0
billion sale expect microchip technolog inc mchp quarter,1
rt sl green realti q ep beat estim sale beat estim slg,1
analyst expect whirlpool co whr post quarterli sale billion,1
cma open interest matur high put high call maxpain option,2
manikay partner llc increas monsanto co new mon hold million,1
number user lead mobil payment platform worldwid august pypl baba aapl amzn,1
newfield receiv buy rbc capit nfx,1
rt momo januari put sold open stock replac see bullish posit op,1
q earn estim suntrust bank inc issu jefferi financi group sti,1
rt interact broker revenu surg margin brokerag account ibkr td schw qqq spx via,1
real question must vote got offer support apd stipend discord,1
equinix eqix coverag initi bmo capit market,1
comment spi qqq dia sh iwm tza sso tna voo sd ivv spxu tqqq upro psq spxl uwm rsp spx,1
rt bull tripl money pg via,1
trmx uno de mi mejor trade dur segundo fue al estar leyendo algo impreso cuando de reojo lo monitor,1
ep expect alliant energi corpor lnt,1
rt airdrop vote df wolfex amp receiv df rule retweet tag friend follow exchang join,2
apach corp apa posit maintain elm ridg manag llc,1
jefferi financi group reiter hold rate kimberli clark kmb,1
mettler toledo intern c mtd sharehold william jone amp associ llc decreas posit market valu declin,1
short sale volum short interest bll cck tap wrk pkg,2
investor sell oneok oke stock follow today jefferi downgrad,1
q ep estim assur inc reduc suntrust bank aiz,1
get access premium paid group fraction price join us chp,2
bullish big mac bullish occur pm jul gap inc gp gp want earn regist h,1
guggenheim reiter price target advanc auto part aap,1
top money flow today free stock app ive vtv spi nflx biv eem amzn jpm,2
trip via com anoth sweet chart set swing trade,2
ms shop im box hum ms era hub,1
dr pepper snappl group dp stock rate reaffirm stephen,1
final time make move morgan stanley initi coverag nobl energi nbl price target,1
analyst bullish oneok inc oke week,1
extra space storag inc exr analyst see ep,1
rt unusu put buy ewu x averag volum oclr x grpn x erj x swk x ggp x foxa x wday x,1
aaoi morgan stanley comment mean noth simpl profit take nasdaq lifetim high yesterday,2
rt stock etf amp fund review alphabet hei hewc hiw hog holx hpr hpt hqcl hqi hr hsc hscz hsic hta,1
rt top declin premarket hour nflx iq wpp tqqq unh qld bti bp vod dgaz intc roku,2
regenc center corpor reg analyst see ep,1
cmcsa di fox comcast own cnbc report comcast focu acquir sky tv bid higher fo,1
ep intern paper compani ip expect,1
research analyst weekli rate updat intern paper ip,1
billion sale expect norfolk southern corp nsc quarter,1
whirlpool co whr receiv averag price target analyst,1
see cdix offer stng f dal uvxi bbd fcx msft iq pfe uso c xle ak teva mfgp bmi dwt,1
rt next bzun still bullish especi recoveri late day today next major resist ath could e,1
apolog forgot one initi list also arri,1
dxc technolog dxc upgrad hold valuengin,1
analyst bearish side mid america apart commun inc maa week,1
rt innv innovu pharma soar blowout earn news ea mu pypl siri fisv symc chkp swk ca stx,1
carrizo oil amp ga inc heavi volum carrizo oil amp ga inc stock crzo,1
intern flavor amp fragranc inc iff major sharehold acquir stock,1
union bankshar hold raytheon co rtn cut share price declin mrj capit trim posit viaco,1
cnp max pain matur maxpain option,0
rt goldman sach swap perrigo johnson amp johnson rate jnj prgo,1
guggenheim initi coverag netapp ntap,1
oppenheim equiti analyst reduc earn estim synchroni financi syf,1
insid sell equinix inc eqix insid sell share stock,2
rt earn week nflx bac msft ge blk gs unh ibm jnj clf jbht pgr abt ms isrg axp skx aa csx uri,1
bendigo amp adelaid ben lift interest rate cycl owner occupi amp investor loan due,2
trip high oi rang option expir maxpain option,1
nobl energi inc nbl stock institut investor feel good,2
axp wait cc pm turn green tomorrow posit capit distribut news buyback dividend,1
mani patterson compani inc pdco analyst bullish,1
billion sale expect molson coor brew co class b tap quarter,1
netflix siriu xm team comedi radio spot nflx siri,1
syy open interest matur high put high call maxpain option,2
siri new sec file siri form k,1
q sentiment netapp inc ntap,1
rt vanadium hit year high mani asx list compani progress project tng tno look cheap,2
newfield explor nfx earn buy rate royal bank canada,1
high frequenc breakout asgn gs hr,1
rt break northrop grumman ceo we bush step jan kathi warden compani presid chief oper,1
ep aetna inc aet expect,1
rt hemp hemp inc commend u senat pass farm bill hemp legal decad,2
xray dentspli sirona inc sec file form,1
even tweet small cap check gambist top mdxg blmt sgmo akao pgc gogo expi frta gluu,2
rt final holli grail electr car within reach even end elon time expect l,1
platform specialti product pah rate increas sell valuengin,1
tri swing trade servic built individu want trade longer term timefram around full time,1
rt tel telephon number enough need bank even need internet recipi telcoin,1
water wat versu eyepoint pharmaceut eypt head head comparison,1
rt get adm free follow visit regist,2
rt heard tune ft avi speedz side savi speedz soundcloud np,2
join us get premium trade signal join us omni vibe aapl qtum fcau oxi,2
kmb repeat unusu sweeper detect,1
im mr star dang im ms usa see ms flo shop,1
annali capit manag inc nli ep estim,1
cm max pain matur maxpain option,0
rt gemroyalti co tnrgold tnr v shotgungold project kirillklip next step shotgun find explor partn,1
ad sq flex swing today,1
royal caribbean cruis ltd rcl expect post quarterli sale billion,1
rt bzun watch iq blow today look like love bzun futur,2
mro he xom cvx cop oxi eog brave peopl game money come way,2
analyst see nasdaq inc ndaq past week,1
investor gaug watch level electron art inc ea ea stock stockmarket,1
hess he earn hold rate bmo capit market,1
cnbc comcast focus sky unlik top fox bid fox foxa skyay cmcsa,2
could analog devic inc adi chang direct short,1
nasdaq biggest gainer chr avro smrt ahpau ahpaw avt avro awr acl axgn aaxn axon,1
analyst bullish dollar tree inc dltr week,1
pretti amaz tape today think momo wane es f es spx spi nq nq f ndx qqq,1
cypress semiconductor corpor cy ep estim,1
dri top dcix orig greekkk garbag scamm play loll stupid americano lol,2
short interest mondelez intern inc common stock mdlz declin,2
roper industri inc rop share declin meag munich ergo kapitalanlagegesellschaft mbh decreas posit,2
assur inc aiz ga even less seller involv,1
omnicom group omc hold rate reaffirm well fargo amp co,2
break news etn rebrand eta soon electroneum,1
boom quarterli revenu jump b ibm cybersecur mssp,1
ep expect platform specialti product corp pah quarter,1
propel norfolk southern corpor nsc reach time high,1
david r rahn amp associ hold hold illumina ilmn gray televis gtn share price declin boothbay,2
ep concho resourc inc cxo expect,1
mmm max pain matur maxpain option,0
long short bitcoin volatil x leverag bitmex get fee discount,1
offic depot odp downgrad zack invest research,1
analyst anticip pentair plc pnr announc earn per share,2
fluor corpor flr short squeez soon stock form bullish doubl top pattern,2
tsn tyson food inc sec file form k,1
cowen pick pan q name best potenti report q result excess consensu includ alxn,2
top sq cvna w wwe mu tsla blue yriv amd shop nasdaq nyse invest,2
short sale volum short interest qep swn cog dnr pxd,2
nuan back earn let see hold gain,2
wednesday week high amp volum mth avg ual gww asml csx eric chr vnet abt sap axp five immu arwr,1
jerom powel testimoni begin today stock market watch via cl es nq,1
mosaic compani mo analyst see ep,1
rt fginvest brasil confirmando el excelent momento por el que est pasando equipobursatil de suben con fuerza,1
rt thank mark zuckerberg cannot take idiot bigot conspiracist public squar free think matter n,2
rt cpa cpb coinpool cpb,1
ntnx new insid file potti sunil transact code,1
citigroup reaffirm target price per share willi tower watson wltw stock also r,2
wonder risk ctx day volatil,0
