discuss stir around marriott intern inc mar week analyst say,1
capit one financi corp cof holder second curv capit llc boost posit million,2
raymond jame trim e trade financi etfc target price,1
critic contrast consolid edison ed versu ameren aee,0
mmm afl abbv abt apd ao adm adp bdx cah cvx cinf cta clx ko cl ed dov ecl emr xom frt,1
dodg amp cox boost metlif inc met stake,2
keycorp analyst rais earn estim extra space storag inc exr,1
share buy back programm sp group spg,2
analyz robert half intern rhi amp kelli servic inc class kelya,1
mckesson corp mck share valu declin kiltearn partner llp increas hold,2
although technic rate bad eqt present nice setup opportun eqtecplc,1
ctl fomo start saw nice market buy flow morn spur book action,2
pono capit offer purchas share cpb per share cash,2
faster coin list bot join us music ak act md,2
today great trade day made k daili option trade amp hey reduc thei,2
rt icnb late break news beverag abev bud sam rox born kof ko cce ccu stz cot deo,1
analyst adopt bullish outlook northrop grumman corpor noc,1
nordstrom jwn rais outperform telsey advisori group,1
rt u labor board judg reject mcdonald bid settl major case whether account alleg labor law violat,0
sysco corpor syy fuel run low stock reach record high today,0
morgan stanley ms share gap follow strong earn,2
look like vz may bit sell near futur probabl bit earli gradual ad aug,2
kss wmt tgt jcp cost amzn bet amazon wish pest go,2
simon properti group spg pt rais barclay,1
firstenergi corp fe institut investor sentiment index worsen q,0
zack invest research downgrad fluor co new flr hold,1
equinix expand aw collabor latin america eqix,2
rt cmcsa di fox comcast own cnbc report comcast focu acquir sky tv bid higher fox ent,1
rost realli friski close think break tomorrow,1
mo high oi rang option expir maxpain option,1
rt think icahn letter say appl worth sold mil share h,2
poll btc knc wabi ama act ama amlt ama efx quadrant protocol,1
wonder risk himx day volatil,0
rt mead smart friend tell buy aprn exactli price go within week,2
made k today trade option trade gbr aapl msft jd cbrl exp c,1
rt cei nyse amex camber energi soar today plan amzn tsla wmt tgt nvda spi gld ebay,1
fiserv inc fisv fuel run low stock reach time high today,0
gern jnj celg inci nv abbv still fun still one,2
evhc whack chano short comment confer,1
aeo amd arnc azul bac bbt bpop c cae cvna db exa gden gol irdmb jpm lbtyb,1
analyst bearish zoeti inc zt week,1
newfield explor nfx upgrad buy zack invest research,1
q ep estim concho resourc inc lift keycorp cxo,1
stagflat fuck mani correl trade long xop short xrt pair oil retail good idea,1
decluttr survey u singl would prefer date iphon user aapl,1
rt marc alt bag biggest smallest dp eqt lck oot kmd cag linx tel ubq loci etho dbix lbc pbl flixx qwar,1
join us get premium trade signal join us hmc show xcp gme yoyow fuel,2
public servic enterpris group target unusu high option trade peg,1
gener mill inc gi stock price sentiment crash,0
alk alaska air group report june oper result stock news alert app,2
omab pac amx rycey bjchi foxa cmcsa di nke cpb,1
short sale volum short interest aveo biib regn arql amgn,2
rt costco take onlin groceri deliveri canada cost,1
accentur plc ireland acn market valu declin morgan stanley trim posit,1
share cvx acquir usd per share cost usd,2
rt atossa genet announc intraduct microcathet immunooncolog pre clinic program breast,1
ms rerank auto retail consolid outlook kmx lad pag overweight abg evenweight sah downgrad underweight,0
analyz telefonaktiebolaget lm ericsson eric amp l technolog lll,1
rt small list fomo ico current trade ico price atonomi atmi cpchain cpc endor edr essentia ess gonetwor,1
aapl ad adt afgl allk autl avro axp bac bk blk bx c ccb cfg clw cmcsa cnst cof crnx ddaif,1
amazon help nasdaq reach anoth record high spi dia qqq jnj nvda adb googl fb,2
tmc member amat gap open today pleas rais stop stock,0
rt want trade df find us follow exchang,1
wonder risk stt day volatil,0
rt earn aa abt asml axp bac bhge blk ce clf cof csx cta dhr dpz ebay etfc expo ge gs gww hon ib,1
pfe new insid file young john transact code,1
bmi bloomsburi fashion footag archiv project get fashionista excit person think fashi,1
u silica hold inc slca receiv averag price target analyst,1
binanc one top crypto exchang sign regist bonu,2
kiltearn partner llp rais mckesson corp mck stake million,1
auton inc holder privat manag group inc cut posit stock price declin,0
high iv watch list snap gt ua akrx igt uaa aaoi car hbi fosl symc kmb ma wtw biib azn skx,2
scan result pullback bullish today petq cvg exr atu optn cube msgn lw ntri psa,1
rt helsinki underway worth note past year u approv foreign militari sale javelin,2
rt ibm seek million groupon disput earli internet patent via ibm grp,1
rt capit market laboratori option backtest cml trademachin via,1
market rethink review sprint mobil deal tmu,1
rt binanc distribut everi fork mean get free airdrop regist bonu enrg uct ltc,2
mxc float nichola taylor own share royl cei gbr bhp oil ped tgc dnr,2
hotspot summari result es cl ym nq,1
zack brokerag anticip idexx laboratori inc idxx announc earn per share,2
fbh new sec file fbh form k,1
analyst see ep avalonbay commun inc avb,1
nudg howard schw recent great earn report day ago amp financi gener,2
trendlin broken gap clx gave bearish bia got short min setup mindthegap gaptrad,0
dentspli sirona inc xray analyst see ep,1
electron art inc ea analyst see ep,1
assur inc aiz report decreas short,1
farmer trust co decreas posit lauder este co inc el million share rose,2
join us signal multipl paid group one join us bat ont xbi,2
amp amp amp amp amp amp amp amp sd sd amp amp,1
cb twtr trump putin helsinki show proce shadow indict via,1
critic comparison water wat vs eyepoint pharmaceut eypt,0
q ep estim l technolog inc boost jefferi financi group lll,2
northern trust ntr issu earn result,2
wast mgmt inc del wm sharehold bb amp secur llc trim posit million valuat decli,1
lite lumentum hold inc sec file form,1
invest crypto binanc get discount trade fee regist bonu,1
benzinga top upgrad downgrad juli nflx vfc wfc up dri vcel ta mogo,2
irm ironmountain iron mountain award place g cloud digit marketplac stock news alert app,2
million sale expect cooper compani inc coo quarter,1
g gg coil tight bb volum dri tell share one strongest p,2
analyz valero energi vlo amp hollyfronti hfc,1
upcom earn report nflx schw fhn nsm neofg unh csx fult hwc hcsg hope,2
newfield explor nfx hold rate reiter bmo capit market,1
strong result pru group aisc us oz record group gold product oz ca,2
rt earn schedul open tomorrow abt ms gww asml txt eric mtb usb nv ubsh ntr mtg,1
trow max pain matur maxpain option,0
rt grizzl aphria acquir solid latam asset extract meaning valu far better valu canopi latam purchas aphri,2
spx rang es f tvix uvxi vix,1
rig short term neutral long term trend still posit much worri,1
analyst bearish synopsi inc snp week,1
htz dip buy pay lunch money rest month lol,2
notabl sale amp spread tuesday sr stock replac green line bought salmon line sold,1
avgo gs cut mlnx rais piper cake rais barclay eat rais,0
sold sqqq buy profit bp volq sidebook manualtrad spx spi es f es fb aapl amzn nflx goog qqq,2
ep expect centen corp cnc quarter,1
vrx current report file k,1
financi survey altaba aaba amp convergi cvg,1
rt watch latest stock signal video hotstock hd ttwo yndx use elliottwav indicat,1
move trade crypto exchang today sign regist bonu,1
twenti first centi fox inc fox stock price rose sharehold highvista strategi llc boost stake,2
rt arri nccn guidelin recommend braftovi combo mektovi binimetinib categori treatment option patient wi,2
watch latest stock signal video hotstock hd ttwo yndx use elliottwav indi,1
energi transfer equiti lp unit ete vs nation grid ngg head head comparison,1
henri schein hsic rais buy zack invest research,1
argentier capit ag cut hold lilli eli amp co lli share price rose,1
biggest market loser mtsl aveo cei coda alt hzn bbox gene omc ag vktx innt serv isr aytu,0
barclay begin coverag consolid edison ed,1
stockmarket one bank move offici breakout financi catalyst test spx hi,1
top blockchain project buy hodl tomo tomochain basechain aid scalabl ethereum mn,2
baker hugh ge bhge schedul post quarterli earn friday,1
pultegroup phm releas earn monday,1
rt discount trade sign today amp enjoy discount regist bonu pe bat salt,2
rt new updat washington insur regul say contact w doj regul direct inform,1
neo littl gem nep x toll efx swth,1
ep expect weyerhaeus compani wy,1
turquois hill resourc trq cut sell valuengin,0
mark well within reach pentair plc pnr,2
alliant energi lnt versu public servic enterpris group peg head head contrast,1
rt big call activ cop stng nflx opk luv msft riot paa rig kor bx serv yndx vi,0
rt adp aapl v fb nflx apc aal mgm hog afl oakmx bmi hlt,1
iff gfn dish cnbka bstg,1
discoveri commun inc common stock disca expect post fy earn per share,2
buy sell bitcoin chang x leverag bitmex get fee reduct,1
short sale vol short interest grpn inwk lyv ebay xoxo,2
xle goe posit brent amp wti ralli xom exxonmobil buy rest gasolin inventori fell,1
rt long setup irdm ftnt esrx pypl info ea ice team omer zen immu crsp,1
tyson food inc tsn expect post quarterli sale billion,1
hca healthcar inc hca holder sivik global healthcar llc trim stake stock rose,1
rt tradin mxc float nichola taylor own share royl cei gbr bhp oil ped tgc dnr mng,2
qrvo qorvo inc sec file form,1
ddr new sec file ddr form asr,1
xcel energi inc xel receiv consensu target price brokerag,1
rt tsla steadi foot cashflow wise hit depend magnitud next recess bad news,1
dte energi co dte neg stock sentiment,1
rt view chang tuesday spx open critic exposur net long volatil svxi uvxi hedg,0
latest figur make stock even attract accentur plc nyse acn stock stockmarket,2
he open interest matur high put high call maxpain option,2
netflix bring comedi new siriu xm channel nflx siri spot amzn di,1
aph pickup today case chang direct posit set support h,2
rt et daili digest larg amp mid cap stock amp premarket arnc jb,1
rt yay anoth doubl dgi class abbv blk ba tif msft lost count awesom job coac,2
featur volatil stock republ servic inc nyse rsg rsg stock stockmarket,1
procter amp gambl compani pg sharehold johnson invest counsel inc boost hold million sh,2
ph new insid file vp pre instrument grp william r bowman,1
watch live deborah birx becton dickinson compani ring open bell celebr th,1
ad utx aug jul call diagon,1
top declin gt csvi omc serv yaski ecpg hegiy bzq nflx asmvi wpp smecf nfyef bioq gnrc utmd,2
pfizer lilli tanezumab success late stage osteoarthr pain studi premarket pfe lli,1
prudenti financi pru rate increas buy zack invest research,1
rt bitcoin giveaway rule follow add telegram retweet amp li,1
automat data process adp coverag initi analyst wolf research,1
rt monday buy line fcx lv pbr gt cs epc tsco pbr bac msft iq fti rrd schw swn nrg eca opk tsro cb,2
big biotech stori watch tnxp admp gwph pfe biib,1
strong u retail sale lift q gdp estim retail sale june vs last year spi amzn qqq,2
met cub yum stay ms air ms sam two men ago,1
analyst take look fidel nation inform servic inc fi say,1
delphi technolog dlph stock rate upgrad morgan stanley,1
rt rbc mackay biotech q earn preview see potenti top line beat exel alxn sgen bmrn model amgn achievi,2
trip base near high er aug,1
incyt corpor inci sharehold tekla capit manag llc cut stake million,0
u silica slca downgrad equal weight morgan stanley,1
coin list pump bot detect offici announc join us,2
analyst see ep oasi petroleum inc oa,1
rt hot stock today cntf kiq izea scyx jagx huya staf ntra tndm ccih glmd ca zgnx fpi pzza save asmb,2
top st dividend aristocrat momentum adm jnj pep ko wmt bottom dov emr cah cvx,2
etf hold stock insid want fiw idxx grc etf,1
want automat email alert pdce ssnt chuy rrc adsk subscrib marketbeat daili,2
ok spi held said want buy hope stop anyon,2
rt invest invest fund marijuana opportun dm us aero abbv acan acnff acbff agstf ammj aphqf attbf axi,1
rt neat news crypto cryptocurr altcoin altcoin dallar dal,2
buy archer daniel midland compani adm lower short interest win strategi,2
bhge baker hugh announc agreement sell natur ga solut busi two separ entiti,2
aapl nflx goog fb amzn msft name account amp p return ytd,1
get fortnit v buck origin price info dope xvg cct trig,1
coin list pump bot detect offici announc join us,2
nasdaq schedul hear consid neovasc appeal delist determin nvcn neova,1
brokerag expect autodesk inc adsk post quarterli sale million,1
move trade crypto exchang today sign regist bonu,1
ogi ogrmf light today aph potstock,1
market ii affirm gain airlin railroad stock dow transport lead index,2
airlin happi time luv dal,1
citigroup trim westrock wrk target price,1
rt innv break news innovu pharma report prelim year yr revenu increas q mil abev bud,1
yum brand inc yum analyst see ep,1
activ trader tri one free trade guid nflx tsla aapl jwn gs fb amzn googl nvda,2
rt crude cl sinc oott brent,0
sentiment chang report express script hold co esrx,1
de long call worth watch via,2
alphabet take b charg q eu fine goog googl,2
exa exel hd mu avgo mar opk amd gild mrvl biib ca ibkr lrcx nvda orli pypl tsla inci fox,1
analyst expect array biopharma inc arri post earn per share,2
watch latest stock signal video hotstock hd ttwo yndx use elliottwav indi,1
investor buy share boston scientif bsx weak,1
look insid market top biotech fund lxrx mygn arri fmi nvcr rgen fold inva mnta xlrn derm gbt,2
ep expect cardin health inc cah,1
zack brokerag anticip fidel nation inform servc inc fi announc quarterli sale b,1
monacoin mona price binanc registr onlin check,1
ep marriott intern inc mar expect,1
ameren corpor aee fuel run high report show less seller,1
flex flex downgrad zack invest research strong sell,2
rt ew tri leav base w k aug call oi recent accumul,1
spi qqq ba ccl csx gs jnj nclh nv pfe rcl schw tsla ual unh goog googl mgm txn,1
acn accentur inde end get breakout,1
analyst see ep metlif inc met,1
trade war far impact industri demand prolog ceo say pld,0
estat asset watch lead stock today amzn nflx baba aapl fb mu nvda foxa googl tsla twtr msft,2
western digit wdc downgrad hold zack invest research,1
rht weekli call spread nearli note buy earlier week reason,1
norfolk southern corpor nsc set record high strong momentum holder,2
analyst see ep motorola solut inc msi,1
ep expect envis healthcar evhc quarter,1
mid america apart commun inc maa expect announc quarterli sale million,1
huge coin select low fee reliabl join binanc regist bonu,2
rt binanc distribut everi fork mean get free airdrop regist bonu enrg uct ltc,2
acn nice breakout watch pullback retest,2
rt abbvi licens humira patent mylan biosimilar sale five year away premarket,1
rt u set becom world top oilproduc govern say uso dvn bp rd oilandga,2
rt ibd big cap rank juli crm panw twtr algn fb nflx ilmn v lulu isrg cta idxx bsx,1
rt new coin ad kbc fti pch quro seer coni ess onl otb pai got thrt bitscreen h,1
exr new form extra space manag stock news alert app,2
close call made k yasss thank option trade infi iclr spi,2
get access premium paid group fraction price join us etp,2
q ep estim henri schein inc hsic lower analyst,0
brookfield asset manag inc decreas american tower corp new amt stake million,2
heard tune ft avi speedz side savi speedz soundcloud np,2
action growth stock googl pypl race epam zto aapl athn carg cop eog ew eye flt hubg lh,2
analyst see ep fortun brand home amp secur inc fbh,1
buy arcon inc arnc lower short interest win strategi,2
rt anoth big day dividend portfolio tech stock outperform led txn microsoft hit fresh,2
rt et daili digest larg amp mid cap stock amp premarket vfc chr,1
newfield explor nfx lower neutral goldman sach group,0
rt pxd check buy signal minut chart,1
trndg ni nbl run biib chart,1
nee max pain matur maxpain option,0
xerox xrx lift buy standpoint research,1
rt excit ring close bell ppg ppg,1
binanc fastest grow crypto exchang join us regist bonu,2
cooper compani inc coo issu dividend,1
dhi call alreadi pay thought mind sell daytrad daytrad mrserb ripparoni,1
rt wrong kmb asset sell retir,1
uh open interest matur high put high call maxpain option,2
wyndham worldwid corp stock wyn ga even seller involv,1
rt follow po coin zoi opcx dev xsn bitg ult xrh wage colx xlq ext flm gic dxc spd,0
varian medic system var schedul post earn tuesday,1
trader buy share edison intern eix weak,1
nelson robert invest advisor llc increas posit illumina inc ilmn,1
hd max pain matur maxpain option,0
trend revers alert cm cm energi tradeidea via free trade room,2
analyz quicklog quik finisar fnsr,1
could costco wholesal corpor cost go touch time high,1
hd suppli hold inc hd receiv averag rate buy analyst,1
short sale volum short interest aeo bke expr anf gp,2
bf b brk b cpb ko tap deo bud khc,1
discov financi servic df lower hold zack invest research,0
chrw high oi rang option expir maxpain option,1
bull run anyon efx show real promis past hour cryptocurr crypto blockchain,1
akamai technolog inc akam director paul sagan sell share stock,2
biib high oi rang option expir maxpain option,1
st centuri fox foxa impli volatil index decreas vs hv,1
btw estim earn per share stt current price,2
hca healthcar hca bond trade higher,1
agil technolog inc stock declin hoplit capit manag lp decreas million,1
rt ice nyse ice complet acquisit chicago stock exchang chx,1
trndg endp mro bioc opk vstm gpor sbh akrx chart,1
marathon petroleum mpc upgrad zack invest research buy,1
cimarex energi co post q earn per share jefferi financi group forecast xec,2
hedg fund manag marc larsi say bitcoin k possibl,1
srpt fcsc rckt abeo capr shpg crsp edit ntla ziop flxn rgnx bmrn rare qure vygr bntc kri sgmo,1
bzun srini donapati success rate return great return quick,2
central bank amp trust co cut posit analog devic inc adi,2
rt job billion tabl wa get lithium valley right volt age energi barron drive next wave,1
rt ayab ekusuko project goe well abl contribut origin author secondari creation oth,2
symantec corp symc holder ancora advisor llc decreas posit million,1
elm ridg manag llc boost apach corp apa hold million,2
utx prev day high newhod,1
pay fit born cube tap big,2
mtt weekli watchlist juli th noc ldo pzza,1
cardin health inc cah ep estim,1
wonder risk arnc day volatil,0
mmm men box hum mr joe lock ace one,1
stellar xlm price binanc registr onlin check,1
still stock trade lower daili buy area keep wait lower like sell elliottwav,0
momo ad watchlist potenti break fall wedg rang retest former earn winner china favorit,2
rt texa instrument ceo resign code conduct violat txn http,0
loew corp increas stake aetna inc aet,1
indic spotlight citrix system inc ctx ctx stock stockmarket,1
dd amp amp amp amp amp amp amp amp sdd sdd amp amp,1
middl fang induc bubbl fb amzn nflx googl nvda mu baba tsla,1
valuengin upgrad platform specialti product pah sell,1
rt discount trade sign today amp enjoy discount regist bonu pe bat salt,2
nflx siri netflix siriusxm team creat comedi radiost watch,1
techcrunch up test amazon amzn key style deliveri program new york http,1
decis token hst increas day,1
pnr pantoro weekli chart end jul,1
rt helsinki underway worth note past year u approv foreign militari sale javelin,2
review patterson uti energi pten vantag drill vtgdf,1
rt et daili digest larg amp mid cap stock amp premarket ca pzza,1
zoeti inc zt sharehold northcoast asset manag llc cut hold million,1
jnj brk b rspp hbi jci ge vz pgr cat acn eog kr v pfe pg xom fmc schw kbh tjx mmp dxc largest,1
rt right record fine eu goog comparison aapl street eu real,2
trade war fear seemingli hit home today take stock like rh w wsm tpr el,0
advanc auto part receiv hold stephen aap,1
miss regist binanc close registr btc,1
rt top notion uoa bearish pm est spx gpro post nflx six htz tsla kr unm chk,2
hershey webcast second quarter confer call hsi,1
b riley set prudenti financi q earn estim ep pru pru,1
hi cri cop flow one coup fun,2
cash except jpm aug took small loss sq today damn thing useless today,0
holder ulyss manag llc increas hd suppli hldg inc hd posit,1
eog resourc inc eog issu quarterli dividend juli st,1
wonder risk dhi day volatil,0
unusu heavi option volum today open includ fisv fast rop fti pep,1
barclay reconfirm darden restaur dri overweight price object,0
bull crossov stock cck cni gsk hog hubb jnj slm stx,1
rt hemp hemp inc commend u senat pass farm bill hemp legal decad,2
effect loop capit upgrad csx csx share,2
defensivo lo veo factibl en os ado alphabet goog acci n,1
arthur j gallagh amp co ajg expect post quarterli sale billion,1
intern paper ip downgrad zack invest research hold,1
rt ibm revenu growth strateg imper cloud acceler q,2
stephen releas research report ati ad axp bg calm cbsh cmp cutr df hrl jbht tree rdfn sc,2
research analyst offer predict american intern group inc q earn aig,1
rt read short articl ron alvarez highlight blockchain potenti protect,2
info new insid sell share,2
stanley black amp decker swk stock rate lower zack invest research,0
fiserv inc fisv ep estim,1
di cannot justifi pay b fox asset,2
biotech hc new revisit week low agen akao cyh dnli enz gnca idra lci npd ormp sbbp,0
pfe pfizer morningstar pfizer lilli post strong tanezumab data encourag side effect profil pfizer,2
warden list new ceo via govcon noc,1
info pep five thing need know start day via,1
oneok inc oke stock buy make week high,1
rt abbv apd cah cvx dov ed jnj kmb ko mcd pep pg wba xom,1
top bearish list today mbi wb htbk nine anat lnth tm slm spn fun,2
join us nao quarterli confer call tuesday juli aest call detail,2
rt top bearish list today mbi wb htbk nine anat lnth tm slm spn fun,2
commun trust amp invest co hold hca healthcar inc hca decreas million market valuat r,2
share repurchas program author northern trust ntr,2
prefer payment method onlin shopper worldwid march btc pypl xlf,1
everest group ltd receiv consensu rate hold analyst,1
swk stanley black amp decker announc dividend increas per share,2
ingersol rand plc ir receiv consensu pt analyst,1
comerica cma upgrad buy bank america,1
rt year farm bill could deliv new yet old crop u agricultur hemp de mo cf,1
kyniko chano reiter short call mednax evhc md,1
fortun brand home amp secur declar dividend premarket fbh,1
foot locker inc fl expect post quarterli sale billion,1
disck high oi rang option expir maxpain option,1
interest northrop grummon x b drone non us air show gt weapon,2
cnp new sec file cnp form sc g,1
billion sale expect wast manag inc wm quarter,1
daili recap yesterday today trade record singl day gain yesterday,2
rt stc zt juli call c,1
litecoin ltc valu binanc distribut everi fork mean get free airdrop,2
rt nv avx type sma bla file q biib ion,1
rt recap chatter isr hsic snap foxa twtr chatter pfe,1
ew open interest matur high put high call maxpain option,2
rt impress gain social media front nrg crypto,2
trend revers alert amg affili manag group tradeidea via free trade room,2
rt small list fomo ico current trade ico price atonomi atmi cpchain cpc endor edr essentia ess gonetwor,1
mgm pre mgm sue vega shoot victim push avoid liabil abc news,0
jim cramer share thought appli materi deutsch bank opko heath amat cah opk itw db,2
anoth potenti fail break blk,0
cei camber energi inc usa oil amex wipe debt stock soar pg mrk myl vrx vrtx biib bmi,0
rt stock etf amp fund review alphabet mbio mbt mdc mdca mdlz med mgc mgp mgpi mic mitl mlab mlhr ml,1
rt initi arr brg ceqp cop ebix eght egn emr env etn fmbh ful gd glmd he hon hum lfgr,1
public servic enterpris group peg pt rais morgan stanley,1
auton announc second quarter earn confer call audio webcast schedul wednesd stock news alert app,2
hsi open interest matur high put high call maxpain option,2
institut investor sentiment indic mckesson corp mck increas q,1
suntrust bank comment sl green realti corp fy earn slg,1
firstenergi fe upgrad buy zack invest research,1
whirlpool whr buyer juli put open tend move ge earn,1
rt es hat mich nur jahr gekostet um zu erkennen dass ich statt var fals somecheck var tr,1
jacob levi equiti manag inc decreas netapp inc ntap hold million stock price rose,1
rt would like remind tsla sharehold vrx long chanc get shit publicli hit fan ov,1
pentair pnr schedul post quarterli earn wednesday,1
apd air product end day quot alert stock news alert app,2
ohi sbra cci cio cone dea doc gt irm mnr stor umh,2
chart scare everyon fb goog amzn aapl msft,0
nasdaq highest short volum ratio today mktcap gt sho upld ctx hsdt dfbh stnl,2
sq nvda w spot bidu nice breakout look provid tomorrow surpris move higher,2
becton dickinson co bdx receiv averag target price analyst,1
brent oil could test bbl later fall goldman analyst say cog eog uso oil,1
rf rf show support resist technic indic look bullish,2
mtt weekli watchlist juli th cxo hp rspp,1
corn incorpor glw form multipl bottom,1
cl gt cl f cl cl f cl f opec futur daytrad uso eia wti,2
cme group achiev intern adv contract q cme,1
nordstrom jwn upgrad outperform telsey advisori group,1
rt earn week nflx bac msft ge blk gs unh ibm jnj clf jbht pgr abt ms isrg axp skx aa csx uri,1
look yearli perform apc better stock,2
rt earn aa abt asml axp bac bhge blk ce clf cof csx cta dhr dpz ebay etfc expo ge gs gww hon ib,1
amt short sale consist total trade volum signal bearish trader activ,1
coin list pump bot detect offici announc join us,2
rt gnca method improv immunogen efficaci cancer vaccin genocea atla,0
green day dish full size clear setup headach patienc find setup,2
