nflx siri comedi channel expect launch januari,1
rt quarterli earn msft live webcast juli pm edt cloud azur microsoft,1
rt pioneer mida protocol never log vote need help get second masternod mi,2
kinder morgan beat miss revenu kmi,2
bessem group inc lower stake fidel natl info svc fi million,0
allegion all lift hold zack invest research,1
reilli automot orli given price target credit suiss group,2
j b hunt transport servic jbht price target rais credit suiss group,2
brent oil could test bbl later fa cog eog uso oil uwt uco dwt sco bno dbo dto usl oott,1
rt discount trade sign today amp enjoy discount regist bonu pe bat salt,2
ingersol rand ir releas earn wednesday,1
ep expect allianc data system corpor ad,1
apa new insid file hoyt rebecca transact code,1
weekli recap sjm price move sinc post pt trade includ shop spi fb x pep ozrk nem,1
flex flex lower strong sell zack invest research,2
univers hlth svc inc uh share declin maverick capit ltd cut hold,1
hershey compani hsi ep estim,1
ross store inc rost shift institut investor sentiment,1
rt best buy best buy today cg episod take look longev big box retail success bbi http,2
think nep nsc beat rais earn cycl,1
nike inc nke project achiev earn growth year nke stock stockmarket,2
iff new insid buy share,2
short interest genocea bioscienc inc gnca declin,2
rt wood go listen rt orangead yung suav amp gucci hon x amp obster toaster amp lil tez,1
capit one financi cof releas earn thursday,1
mani republ servic inc rsg analyst bullish,1
big bullish unusu option activ detect ms lyb bp wfc fxi big bearish teva ung psec sbux,2
ecolab inc ecl expect announc earn per share,2
fbh new form k fortun brand home amp secur inc stock news alert app,2
top ep wallstreet money stock zuo lmnx foe hun prgo get top stock quot amp chart day free,2
consolid edison ed coverag initi barclay,1
franklin resourc inc ben expect post quarterli sale billion,1
btc top last h cash st vme st tn st efx,2
short sale vol short interest rdc sdrl rig esv,2
rt cc exc zip xrp hydro mame,1
siriu xm declar dividend siri,1
keycorp lower american tower q earn estim ep previous amt amt,0
bloom tree partner llc stake mobil us inc tmu trim million share declin,2
summer q govcon earn sked confirm far lmt ba gd noc ldo rtn bah,1
rippl xrp price binanc registr open limit time,1
institut investor sentiment kansa citi southern ksu increas,1
dividend realiti hormel food corp hrl sharehold,1
rt et daili digest larg amp mid cap stock amp premarket vfc chr,1
got paid dividend cvx tgt ed ltc,1
reach mileston albemarl corpor alb short interest reveal someth,2
critic comparison destin xl group dxlg versu nordstrom jwn,0
ae corp issu quarterli dividend ae,1
rt exchang list competit digitalfantasysport df df next gen fantasi sport game token amp arcad base,1
ep nextera energi inc nee expect,1
hig max pain matur maxpain option,0
aetna inc new aet market valu rose farallon capit manag llc increas million posit,1
exchang binanc discount trade fee regist bonu xrp lbc,1
stz cxo jpm hd ual ci hon tss ms var syy dal kmb br abbv nue apc itw up utx largest moc,1
rt barri fitzgerald aura energi asx aee move closer oversea ipo fund uranium vanadium pivot u sweden,1
lithiumwatch aal v alb enrg v fmc lac ml v nlc v nmx orl sqm wml v xmg c lithium chile,1
short sale vol short interest vgk bbt vea sti etp,2
pah platform specialti product notabl market movement million gain,2
analyst set u silica hold inc slca price target,1
rt fli top five analyst upgrad cma bwa avp sun csx,2
noc high oi rang option expir maxpain option,1
rt today kim dania point break ground second phase via,1
rt hilari would martin shkreli circu mark top vrx ibb,2
mani arthur j gallagh amp co ajg analyst bearish,1
evercor cowen name semi pick ahead earn nvda mu mrvl adi lrcx amat,1
arthurjgallagh ajg bidaskscor upgrad held,1
q ep estim akamai technolog inc akam reduc oppenheim,1
rt dji dow ran best fortnight time hit come week could signal end correct mor,2
l technolog inc lll given averag recommend buy brokerag,2
home depot inc hd market valuat declin argent trust compani lift stake million,2
arcon arnc cover jefferi financi group,1
newfield explor nfx earn equal weight rate analyst morgan stanley,1
discoveri commun inc common stock expect earn fy earn per share disca,2
jefferi financi group rais mccormick amp co sh sh nv fy earn estim ep previous,1
dh lead stock scan vnet gww ondk fbr asml rspp eric chr csx ubsh cxo fnf wen,1
cv cv health respond request inform trump administr blueprint lower drug price,0
today roundup import part q wallstreet earn,1
teijin adr rep tinli amp leucadia nation luk head head analysi,1
ajg arthur j gallagh amp co acquir reassur hold inc coverdel stock news alert app,2
zt gapdn fill prvcl prvlo tf bigflt hiday p vol tlm ilm,1
binanc fee x less bittrex regist bonu ukg qau esv rec,1
check interest news stng f dal uvxi bbd fcx msft iq pfe uso c xle ak teva mfgp bmi,2
dentspli sirona inc xray expect post quarterli sale billion,1
spi qqq iwm djia ndx vix nflx aapl tlt tnx vxx uvxi tvix svxi spx inflat bearmarket,2
rt upcom earn releas highest volatil ndl tt skx synt llnw eric ffbc gww nflx nvro clf ad,1
trade x leverag bitmex regist bonu pink san excl atm,1
analyst see ep mettler toledo intern inc mtd,1
equiti analyst set expect digit rlti tr sh sh fy earn dlr,1
cmi max pain matur maxpain option,0
rt arcon arnc octob call bought afternoon amp interest report w,2
btc top last h xe st jiyo st vip st td,2
huge coin select low fee reliabl join binanc regist bonu,2
rt ibm ask u juri award million lawsuit accus groupon use patent technolog without author,2
ep expect ddr corp ddr quarter,1
monsanto co mon sharehold cortland associ inc cut posit million,0
rt tradin rt news oil stock buy pullback mxc royl cei gbr oilandga oil bhp oil ped tgc dnr mnga amlp lng,1
trade binanc discount trade fee regist bonu wfee kore dcr,1
girlfriend tri kept cloth realli see long term valu remind aprn,1
rt ms call buyer bank quick gain via,2
unusu heavi option volum today open includ jbht ad srcl dg mro,1
cagnacci et al l infti algebra tensor hierarchi except field theori,1
insid sell nobl energi inc nbl vp sell share stock,2
dte energi co com dte stock price declin reav w h amp compani inc cut million stake,0
baker elli asset manag hold hold mid maa aetna aet aet holder psagot invest hous ltd cut,1
swk stanley black amp decker inc fast graph fundament valuat number analysi,1
pioneer nat re co pxd stock valu rose lombard odier asset manag usa corp cut hold,1
menageri steel would also impli materi commod ye fcx ccj mo,1
western digit wdc downgrad hold zack invest research,1
big call activ gogo fnd gbt byd jd xlrn bp trox gme vmw nxst amgn fb pg,1
rt see ya one time tonight last hurrah wall street big bank earn amp,2
amzn bbi sne ssdiy goog googl aapl roku,1
melvin capit manag lp trim constel brand inc call stz stake million share price declin,2
top impli volatil gainer brk b cara nclh ci sbux unit ccl hyg twtr f foxa clx huya aapl,2
sell ppg industri inc ppg win strategi stock form bearish wedg,2
analyst feel cb corpor cb,1
american airlin group aal price target cut analyst buckingham research,0
rt new son mo na ttooo,1
bearish outlook reilli automot inc orli week,1
get access premium paid group fraction price join us incnt,2
bot discord notifi faster crypto tracker bot join us ptoy xrl,1
keycorp weigh blue apron hold inc q earn aprn,1
rt cl lod pmet amet cl f cl cl f cl oil daytrad opec futur uso ei,1
reaffirm ddr ddr equal weight rate kept analyst morgan stanley target place,1
nobl energi nbl set new week high,1
nli annali capit manag inc document alert stock news alert app,2
mid morn highest fade compar open min amp vol gt k cara mcd agnc aaoi gi tap,2
archer daniel midland compani adm analyst see ep,1
rt unusu call buy sre x averag volum omc x ggp x itb x riot x opk x eca x nflx x,0
rt netflix creat comedi radio channel siriusxm wsj nflx siri,1
emerson electr emr downgrad hold zack invest research,1
stock technolog sector yesterday reach time high pick gddi ctx panw,1
rt rival retail catch ride amazon prime day tailwind via primeday wmt tgt bbi,1
pioneer natur resourc pxd earn buy rate royal bank canada,1
palestra capit manag llc decreas mobil us inc tmu stake million share valu declin,2
rt xrt spi qqq amzn jcp tgt wmt baba kk dd bbbi bbi huge yoy jump retail sale june,2
synopsi inc snp buy stock report seller,1
zack analyst anticip suntrust bank inc sti announc ep,1
get access premium paid group fraction price join us soar,2
investor feel confid stock amp futur direct centurylink inc ctl stock stockmarket,1
rt citi semiconductor remain posit group long term fundament look intact believ h good buy opport,2
dividend today p azz bf bkhu cmd dalt ddt egif eog ffti gdv ggn glu gnt gudb gut gyld hnw,1
new market perform rate given digit realti trust dlr,2
rt notabl compani report tomorrow open pm unp dhr bk bx bbt trv ppg key fitb nue gpc ad dpz dov,1
west oak capit decreas wisconsin energi wec hold mexico equiti amp incom fund mxe sentiment,1
ppbc grant cancer patent eu unknown bloodi biotech w mil wkh cent unknown,0
huge coin select low fee reliabl join binanc regist bonu,2
xle xom exxon mobil oil bullish yemen houthi say attack aramco refineri riyadh drone,0
rt new coin ad kbc fti pch quro seer coni ess onl otb pai got thrt bitscreen h,1
cpb campbel soup million gain cpb made notabl gain last,2
yum eat ms exam im shop hub par,1
rt transocean chalk two big rig contract premarket rig cop cvx,0
made btc day trade binanc sign regist bonu chp,1
recent siri technic alert macd bullish centerlin cross plu alert,2
get access premium paid group fraction price join us ecc,2
rt put week ago unless clear still look weak report mck,1
gener motor compani gm end day chang gm stock stockmarket,1
yescarta center report q call revenu q gild ibb,1
carmax kmx lift buy zack invest research,1
tdih intc intel found million capit today compani worth littl bit abo,2
analyst see ep dominion energi inc,1
acn new insid file shook ellyn transact code,1
thank benzzinga hire rel appar illiter retard amtd nflx ibkr fb amzn tard,0
delphi automot plc dlph institut investor posit chang,1
ccl holland america line offer hawaii cruis,1
lumentum lite see coverag initi cascend secur price,1
netapp inc ntap upsid touch week high,1
xilinx inc xlnx share valu declin perigon wealth manag llc trim million hold,2
trader buy dish network dish weak,0
slb jefferi upgrad slb today look trade adfn investorshub messag board,1
pioneer natur get buy rate credit suiss pxd,2
analyst see ep aon plc aon,1
ba hold thr much resist till next,1
rt earn week nflx bac msft ge blk gs unh ibm jnj clf jbht pgr abt ms isrg axp skx aa csx uri,1
public servic enterpris group inc peg declar quarterli dividend,1
rt jimchano deliveringalpha bearish physician practic manag compani account scam short evhc md,0
hi jim think irm current level big fan thank,2
rt back dead eli lilli pfizer celebr phiii success blockbust pain drug contend tanezumab lli,0
financi review expeditor intern washington expd amp c h robinson worldwid chrw,1
insid sell blue apron hold inc aprn insid sell share stock,2
rt wall street wake call stock flat djia earn soar ms hous start sink amp,1
gold amp commod weekli review commod weekli forecast gold commod copper,1
exr never trigger invalid take yesterday low fast move come fals move,0
ntr mrunaway offhi news nearhi accel alltf tlm ilm phgap ret mohi dyvol x x,1
binanc stop loss featur help protect asset regist bonu rct,2
abil replay quarterli earn call beauti thing say bank report alway typ,1
rt ibm martin schroeter talk compani revenu growth led cloud tune,2
insid alert chairman presid amp ceo kurziu lawrenc erik mkc bought share,2
apach corpor apa report declin seller strong momentum long,2
htz booom short squeez stat folk,1
mettler toledo intern c mtd share declin william jone amp associ llc trim stake,2
analyst see ep flex ltd flex,1
slm consolid year half look imo earn come,1
invest analyst weekli rate chang qorvo qrvo,1
ep expect ameren corpor aee,1
mani stericycl inc srcl analyst bullish,1
carrizo oil amp ga crzo rate reiter royal bank canada,1
name make cut focu list next week give tri beat market year,0
accentur acn earn underperform rate analyst wolf research,1
next ross store inc rost form bullish doubl top,2
rt everyon els focus cut edg compani tri captur next big thing could mayb make go,0
discount trade sign today amp enjoy discount regist bonu,2
lite chart request nice pattern emerg lite go long stock,2
edward lifesci ew pt rais bmo capit market,1
financi contrast u bancorp usb versu comerica cma,1
libya oil problem libya declar forc majeur anoth oil port amp yemen iran back yemen hou,0
cma buy call kevin success rate,2
short sale volum short interest axon ion flxn nvax xlv,2
short sale volum short interest spi xbi nvo mo amd,2
scan result retrac bearish today cbio sbux cpa hmc pet hgv dov mfc cah ltm,1
isrg high oi rang option expir maxpain option,1
cover call alert array biopharma arri return dec,2
ed max pain matur maxpain option,0
hess he set announc quarterli earn wednesday,1
rt mo mo ca mobif mo mobi visa visa offer philippin fexco,1
navient navi bond trade higher,1
mar max pain matur maxpain option,0
ggp see unusu high option volum ggp,1
top stock trade thursday morn ebay jpm x ostk sq,2
trader sell northrop grumman noc strength noc,2
cigna co post fy earn per share leerink swann forecast ci,2
twenti first centi fox inc fox holder highvista strategi llc up hold million stock price rose,1
xray dentspli sirona inc sec file form,1
chano see neglibl chanc evhc kkr deal break wait,1
compar perrigo prgo amp spring bank pharmaceut sbph,1
ad one lot crm ewz,1
rt trade option usual financ tech made good money msft mostli,2
alexion pharmaceut alxn upgrad buy zack invest research,1
get notifi import coin list exchang join us soc wct nxc wax,2
alaska air alk pt lower barclay,0
short sale vol short interest cnp mdu og ato,2
netapp inc ntap forecast post q earn per share,2
discount trade sign today amp enjoy discount regist bonu,2
rt gold silver plung nem paa gfi gg green kl today ath,2
ntnx awar increas call activ name aug c tie amp chatter idea true b,2
voter expect srpt updat regard gt meet fda think,2
bbi come papa know want,1
lombard odier asset manag europ ltd up hold metlif inc call met million,2
cigna co ci given consensu rate buy brokerag,1
trndg tsla clx opk mtg chart,1
rt downsid momentum alert udr udr tradeidea via free trade room,2
michael parini sell share vertex pharmaceut incorpor vrtx stock,2
fli top five analyst initi nflx ph rok fdx xon,2
amp alta mesa resourc inc amr masco corpor ma ma stock stockmarket,1
discount fortnit vbuck info block time etho ixt coval,0
air product amp chemic apd pt rais,1
texa instrument txn updat q earn guidanc,1
trader sell cigna ci strength ci,2
reit end day modestli lower homebuild jump solid homebuild confid data industri reit pr,1
monsanto co mon stock rose cortland associ inc decreas stake,1
l technolog lll hold rate reiter jefferi financi group,1
rt seriou make live daytrad stock need plan treat like busi,2
ebay ebay issu fy earn guidanc,1
cmg curiou see report time around money flow posit watch cake shak sbux,1
replic skill trader automat bitcoin copi wangzai,1
disca new form k discoveri inc stock news alert app,2
mr rad eat one sea sea rad,1
suntrust bank weigh lyondellbasel industri nv q earn lyb,2
inci max pain matur maxpain option,0
join binanc fastest grow exchang world regist bonu,2
investor like stock show big upsid sarissa capit chief invest offic like,2
campbel soup updat mini tender offer premarket cpb,1
dri darden investor present juli stock news alert app,2
wonder risk bbi day volatil,0
aep american electr power million gain aep made notabl gain,2
meag munich ergo kapitalanlagegesellschaft mbh trim roper industri inc rop hold million,1
rt amazon prime video would get huge catalog boost bought cb network drama netwo,2
ep expect rite aid co rad quarter,1
zcash zec price hurri binanc current accept new user,2
social trend scan sfix twtr mro frac crzo ssti sam col ntap apc,1
kucoin distribut everi fork mean get free airdrop regist bonu,2
mosaic mo price target rais,1
rt delay assembl liquefact modul deliv elba island site push back facil start date,0
carmax kmx upgrad overweight morgan stanley,0
citrix system ctx set new month high,1
amerisourcebergen corpor abc declin short share,2
ebay fuk u cover scum gonna cover lower,0
rt srpt aug call went,1
alpha omega semiconductor aosl vs xilinx xlnx head head contrast,1
rt oil servic time low p expect ton neg stori next month g file oih slb ha,1
analyst feel water corpor wat,1
rt discount trade sign today amp enjoy discount regist bonu pe bat salt,2
r horton inc dhi analyst see ep,1
centen corp cnc expect announc quarterli sale billion,1
short setup see oc myl dwdp amat lrcx alb ph mck,1
kinder morgan inc kmi declar quarterli dividend,2
rt nfx bad technic rate show decent setup pattern nuformixplc londonstock,0
gluu glu mobil stock soar first half,1
rt insi therapeut inc nasdaq insi manufactur syndro cannabinoid medicin first fda ap,1
buy sell alt coin binanc fee regist bonu lba,1
bac vz nflx fb aapl mu ggp pbr taho msft nxpi highest volum strike,1
big repeat bull xlf amp wynn,1
aapl appl di msft nke nvda sbux v ba,1
top ess btc dent eth snc eth vit eth,2
rt week ahead biotech confer clinic trial result ipo cbio cdmo isrg cnst,1
pg open interest matur high put high call maxpain option,2
pbr soport de corto usd,1
cigna corpor ci prospect touch ep growth next year ci stock stockmarket,2
henri schein hsic upgrad zack invest research,1
trader takeaway focu spi nflx uvxi ms csx abt ual,1
senzar asset manag llc cut stake regeneron pharmaceut regn million share declin,2
idexx laboratori idxx amp ipsen ipsey head head survey,1
sentiment report jacob engin group inc jec,1
eu bad mifidii exampl prevent investor uk eu fr,0
semiconductor see unusu larg option volum,1
binanc one top crypto exchang sign regist bonu,2
analyst see ep fidel nation inform servic inc fi,1
sign get fee discount bitmex regist bonu ptoy vois poli,1
rt compani restor faith retail top retail stock buy stock wmt bbi five h,2
htz chatt parient get reward handsomli upsid vs downsid short term,2
million sale expect align technolog inc algn quarter,1
sell signal detect stock hca adb glw jblu newr prgo jci dnb ctsh phm jnj cce okta utx,1
make sens rig outperform slb much ytd amp last mo recent,1
progress pgr q earn beat higher premium faf acgl,2
el max pain matur maxpain option,0
illumina ilmn hit new month high analyst upgrad,1
dougla emmett dei amp mid america apart commun maa critic comparison,0
carniv corpor name naacp equiti inclus empower index ccl,1
rt week watch amd amr amzn aptv baba de di fb mrk pypl rht trxc v wmt good luck everyon kickasswe,2
rt downsid momentum alert pld prolog tradeidea via free trade room,2
bdx becton dickinson amp co breakout,1
eqix open interest matur high put high call maxpain option,2
share eog resourc inc eog acquir lgt capit partner ltd,2
kr kroger compani sec file form,1
mondelez intern inc common stock mdlz see signific drop short interest,2
gener mill leuk aandeel werd ik laatst op gewezen door gi gaat op de watchlist,1
bigger paycheck bigger refund free h amp r block tax reform checkup help taxpay get outcom hrb,2
rt earn schedul market open tomorrow gs unh jnj pgr cma fhn neog pld schw mbwm omc nsm http,1
republ servic rsg cfo charl f serianni sell share stock,2
omg hodler hurt new unlock token suppli use pay team member didnt realli crush price stuck,0
amtd kevin success rate return,2
equinix inc eqix institut investor sentiment drop q,0
row report slight rise asset manag june dji trow ben ivz xlf,2
epoch invest partner inc lift danah corp del dhr hold million,1
republ servic inc rsg hit week high,1
join binanc fastest grow exchang world regist bonu,2
take day day point spi spx qqq better safe amp risk free overli expos right good luck trader aapl fb,2
ep expect henri schein inc hsic quarter,1
rockwel collin col downgrad hold valuengin,1
analyst bullish laboratori corpor america hold lh last week,1
current qtum price binanc registr open limit time,1
compar delek us dk amp marathon petroleum mpc,1
bdx alert new bd sec file stock news alert app,2
rt discount trade sign today amp enjoy discount regist bonu pe bat salt,2
xray new insid file lunger franci j transact code,1
rt qqq min pinbar wick fib day rang googl pypl zs also trade daili fib,1
stifel nicolau boost idexx laboratori idxx price target,2
nextera energi nee research coverag start barclay,1
week signific insid trade juli adp cost nke wsm,1
interpubl group compani ipg share,2
tvix mcrosssma upday accel tf ch offlo dyvol x x dyrng x x,1
rt ge foxa bac mu jd sq roku kdp pag skx nflx baba pcg aaba msft grpn low largest call oi increas h,0
fli intel today top analyst call wall street twtr clx amzn nvda cma,2
financi contrast j smucker sjm versu seneca food corp class senea,1
aal aug put sweep put call heavi airlin,1
fitb max pain matur maxpain option,0
rt stock rais dividend last week epd hfbl tge cmi land jbss agr sach dal dgi divid,1
analyst recommend focu share intel corpor nasdaq intc intc stock stockmarket,2
nvcn neovasc yndx aal baba bbd btg cop pay rf hpq amat wmb iq hal dust nem xlp mrk stng czr,1
trader sell share becton dickinson bdx strength bdx,2
tuesday highest min high trade rang amp avg gain today thirteen min bar,2
ye alb hit wrong key would start potenti breakout thank,1
trade low fee binanc regist bonu ge abt,0
rt yay got unbeliev sold put th win row today congrat class amp coach love buy high qualiti b,2
ep expect enerflex ltd efx,1
revers corn incorpor glw near form multipl bottom,1
compar robert half intern rhi amp kelli servic inc class kelya,1
cv respond request inform presid trump administr blueprint lower drug price,0
aegon n v unusu volum aegon stock agn,1
pypl apc kmb option largest chang volum free option screener,2
emo fli one race ad hi tap noah,1
analyst see ep johnson control intern plc jci,1
head head contrast alteryx ayx momo momo,1
devon energi dvn pt rais,1
ning lai weight l l estim wave equat applic,1
yakira capit manag inc increas monsanto co new call mon hold million,1
next financi crisi bank line bailout blk bx kkr broth,1
jd arri pypl ui min daili setup monday,1
stifel nicolau boost align technolog algn price target,2
activ trader tri one free trade guid nflx tsla aapl ibb gs fb amzn googl nvda,2
rt googl amzn ge msft,1
rt best perform hot ipo ytd iq huya cvna see comp chart aprn avlr ayx bili bsti cblk cday cv,2
citigroup boost tractor suppli tsco price target,2
fireey inc fey expect post quarterli sale million,1
aaoi time big money knock stock get lower price,0
rt earn wednesday juli close spx qqq utd rental uri univl fst ufpi umpqua umpq triumph bancorp tbk,2
insid sell nobl energi inc nbl vp sell share stock,2
huge coin select low fee reliabl join binanc regist bonu,2
norfolk southern nsc earn hold rate royal bank canada,1
index chang matter like human manag walk door new hold amt cci impact futur perform,2
cci crown castl intern corp nyse cci file k entri materi definit agreement,2
compass miner intern cmp amp fairmount santrol fmsa critic review,0
buy sell alt coin binanc fee regist bonu,1
short sale vol short interest nfx eog swn nbl apc,2
cme group inc com call cme stock price declin drw secur llc cut million posit,0
rt kashur bahot kiy ham dono par saja waha mili jaha kashur ham dono mr hiva name suna,1
csx csx reach new year high better expect earn,2
microchip technolog inc mchp stock price rose osterwei capit manag inc rais million,1
rt srpt finish golo ex roll submiss amp submit full nda novemb chanc see fda appro,1
mirror success trader automat bitcoin copi wangzai,2
get notifi import coin list exchang join us auy slr sky ada,2
nation bank financi trim kinross gold k target price c,1
discount trade sign today amp enjoy discount regist bonu,2
short sale volum short interest bp cvx xom cop,2
made k today trade option thank trade win bac aeo axl wfc,2
dish network corp dish expect announc earn per share,2
westrock wrk citigroup reiter buy rate today target share,2
bank sell everyon think buyer accord one school thought mtb,1
miss regist binanc close registr btc,1
nextera energi nee downgrad morgan stanley,1
sonic auto nearli profit warn sah pag,2
second curv capit llc lift capit one financi corp cof hold million,1
seneca food corp class senea versu j smucker sjm financi survey,1
nobl energi nbl hit equal weight rate morgan stanley analyst expect stock price,1
wellington manag group llp decreas pnc finl svc group inc pnc stake million,1
sqqq bought n wait next spi dip,1
rt im shop amzn primeday amp see way much rut rti iwm ym dji djia indu es spx spi fb amz,1
alk alaska airlin cook new season menu main cabin featur fresh west coast inspir ingr stock news alert app,2
analyst see ep hcp inc hcp,1
current wave price binanc temporarili accept new user go,2
corn unveil next gen super durabl gorilla glass withstand consecut meter drop,2
snp synopsi notabl market movement million gain billion mark,2
reilli automot inc orli ep estim,1
calcul day expect return rf,1
zack brokerag anticip comerica incorpor cma post ep,1
trade x leverag bitmex regist bonu xa kmi zni,1
financi survey pc connect cnxn amp baozun bzun,1
mobi sign agreement fexco philippin mo,2
free chrome extens hide tweet shill crypto cash tag amp promot group,2
